天將明YS,3397994055,21,1,460000,469032,一生奔赴一场大无畏梦境，世人轻慢或艳羡着你。,反向预测[大哭],6005400524,3,2023-11-13 08:01:20
Lcreams,1738096062,0,1,510000,510100,,来还愿！！还是临姐第一次现场唱！！！,6005397519,1,2023-11-13 07:58:43
言希mio,78731055,0,0,0,100,一身荣光为你加冕。,这首个人风格好强烈啊，两个人都是,6005319622,1,2023-11-13 00:25:42
幽白黑乌云,286295634,0,2,0,100,词作。完整词作作品见歌单，主页显示不全，只关注私信的话其实很多歌也不会发私信的_(:з」∠)_,来还愿！！！昨晚听到了这首的现场啊啊啊啊啊啊啊啊啊啊啊！！！[多多大哭][多多大哭][多多大哭][多多大哭][多多大哭][多多大哭],6005247556,10,2023-11-12 22:30:14
孤竹流萤,633544996,23,2,510000,510100,琴瑟愿与，共沐春秋。,第一句总是觉得耳熟，想了一下，和花与酒第一句的调子有点像“像流沙之中未覆灭的枯泉”,6005200655,7,2023-11-12 20:59:04
寒牵,1502211822,0,2,320000,320100,“等到风雨停歇 就是我们快要见面的时刻”,真的好喜欢这首！一耳朵爱上,6005195664,1,2023-11-12 20:47:30
乱世舞,1530603168,19,1,440000,440500,,我的歌单，他化自在，应时代品味大劫而生，喜phonk者不容错过,6005155448,1,2023-11-12 19:18:01
汝南兮_,1918610426,23,2,230000,230200,,哭死，致敬两位伟大的女士,6005130749,2,2023-11-12 18:04:29
汝南兮_,1918610426,23,2,230000,230200,,眼看沧海竟成尘，寂锁荒陬百感频。,6005125706,5,2023-11-12 18:04:00
盐梭鱼梨,557080114,0,2,0,100,“情有独钟的是轻狂年岁，独上高楼宣苍龙来会”——《焦骨》本命银临、子弥、慕寒，墙头不才、司夏、贰婶……,长沙见！,6004985619,1,2023-11-12 12:58:44
云匿Rachel-,1890070289,21,2,330000,330100,账号已注销,四五,6004961294,1,2023-11-12 11:57:24
云匿Rachel-,1890070289,21,2,330000,330100,账号已注销,四四,6004962009,1,2023-11-12 11:57:19
云匿Rachel-,1890070289,21,2,330000,330100,账号已注销,四三,6004963792,1,2023-11-12 11:55:34
云匿Rachel-,1890070289,21,2,330000,330100,账号已注销,四二,6004961156,1,2023-11-12 11:55:30
云匿Rachel-,1890070289,21,2,330000,330100,账号已注销,肆意,6004960297,1,2023-11-12 11:55:25
云匿Rachel-,1890070289,21,2,330000,330100,账号已注销,四十,6004961848,1,2023-11-12 11:55:19
云匿Rachel-,1890070289,21,2,330000,330100,账号已注销,三九,6004961839,1,2023-11-12 11:55:14
云匿Rachel-,1890070289,21,2,330000,330100,账号已注销,三八,6004959274,1,2023-11-12 11:54:06
云匿Rachel-,1890070289,21,2,330000,330100,账号已注销,三七,6004960190,1,2023-11-12 11:54:01
云匿Rachel-,1890070289,21,2,330000,330100,账号已注销,三六,6004960182,1,2023-11-12 11:53:54
真的好想喝1点点,395057504,0,2,0,100,听情歌是因为嗑拉了,好吧好久不特意听银临这些人的歌了，但是日推一开口就听出是谁了,6004910751,2,2023-11-12 09:46:30
云印雪,4005256462,16,2,440000,440100,除却巫山不是云,潇湘水断，宛委山倾珠沉园折，玉碎连城甫瞻松槚，静听坟茔千年万岁，椒花颂声,6004761896,2,2023-11-11 23:42:34
宬ch,8821093380,24,0,510000,510100,拨雪寻春，烧灯续昼。,把旧规则 全都摔破，劲风谁能锁，天衢辽阔 光阴磅礴，重写平戎策。,6004748481,1,2023-11-11 23:25:32
小满啊zy,1862296868,16,2,610000,610400,苍梧白头北岸，春秋信笺俱烧与南辕。,分明你我都背负不约而同的怀璧之罪，签订在韶华的结尾。,6004729989,2,2023-11-11 22:48:47
刘某某181017,1643678651,16,2,130000,130900,,银临女神四专加油！这是琉璃之后又三年了，我始终在这里支持着永不离去，银临总能带给我震撼[多多大哭],6004682963,5,2023-11-11 21:27:08
沉沉Aria,3885340088,20,2,320000,320100,,好听！,6004626795,2,2023-11-11 19:24:46
亦书亦乐,4031117187,0,0,0,100,,临姐写歌的角度好特别，都能听到临姐的思考[多多大笑],6004579688,7,2023-11-11 17:42:14
年年在听呀,348494783,0,2,440000,440600,,每一句歌词都好戳我[多多大哭][多多大哭]真的感觉身临其境，回到那个动荡年代，见证了两位伟大女性的一生,6004525696,11,2023-11-11 15:58:41
银临小仙女,250903847,26,2,440000,440300,银临小仙女是我的！,女神的歌曲质量越来越好了,6004514692,3,2023-11-11 15:23:55
烟岚离箫,512822361,22,1,350000,350100,欢乐沙雕,999冲冲冲,6004459334,2,2023-11-11 12:52:08
陌小卿w,6311253844,20,2,330000,330100,天道酬勤 自在随心,我感觉 可能是在微小的事/人物在历史的长河中也能产生一定的影响？（hhh可以去看看热评[奸笑],6004420261,0,2023-11-11 11:07:49
凤嫣,301331333,22,0,140000,140100,随我一起化作明灯。,这样的歌曲就应该大爆！！！,6004408864,1,2023-11-11 10:26:59
凤嫣,301331333,22,0,140000,140100,随我一起化作明灯。,助力999,6004407947,1,2023-11-11 10:26:40
自赏摇滚猫猫,595135176,0,0,0,100,猫猫无处不在,好听到哭了 太美了,6004291343,3,2023-11-11 00:32:49
自赏摇滚猫猫,595135176,0,0,0,100,猫猫无处不在,这首非常不错,6004291210,2,2023-11-11 00:31:25
扬羔发发_,2072273679,21,2,310000,310101,,啊啊啊好听,6004236410,1,2023-11-10 23:23:10
l-南风知我意-l,8551164442,15,2,360000,360100,,好听[憨笑],6004225394,4,2023-11-10 23:01:16
L5276,2023834320,0,0,0,100,5276,太好听了,6004210167,2,2023-11-10 22:33:02
默落morrol,3583746877,21,1,140000,140600,,正在准备明天的考试，突然发现临姐更新了，听到耳机里传来临姐的声音，还是一如既往地让人安心，从初中到大三，陪伴了我无数个日日夜夜，是我最无法割舍掉的底色,6004153840,5,2023-11-10 20:32:22
宴袊,1764058563,0,2,0,100,,啊啊啊啊啊啊啊好好听啊啊啊～我该如何追问最热烈青春～,6004128519,1,2023-11-10 19:41:17
梧桐苑中有家雀,1406990158,0,1,440000,440600,它朝若是两相望，再从头多少美好不放手！,听哭了(´;︵;`),6004114066,1,2023-11-10 18:54:49
顾瑶晞,600534360,0,2,0,100,~o(〃'▽'〃)o,好喜欢！！！两个追寻自由的灵魂的相遇[流泪],6004102535,2,2023-11-10 18:28:25
谁为谁何,325650476,21,0,370000,371000,,ht,6004097225,1,2023-11-10 18:09:59
云村村民165406939221588,7881635157,0,0,440000,440100,,为什么叫沧海飞尘？不懂就问,6004006412,0,2023-11-10 13:17:17
云村村民165406939221588,7881635157,0,0,440000,440100,,致敬两位女性烈士[拜][拜][拜][拜][拜],6004005550,7,2023-11-10 13:14:41
汋录,129301292,23,2,510000,510100,浪漫三分。,明天见！,6003942718,1,2023-11-10 10:22:55
是揪揪不是啾啾_,1330303201,0,2,0,100,南风知我意，吹梦到西洲。,明天见！,6003915861,1,2023-11-10 08:32:32
何须借明月,396252482,0,2,0,100,现世比诗更浪漫,“署名在动荡的年岁”,6000332852,1,2023-11-10 00:22:47
何须借明月,396252482,0,2,0,100,现世比诗更浪漫,“署名在动荡的年岁”,6000378841,1,2023-11-10 00:21:44
刹那芳飞,74889466,28,1,330000,330300,,支持,6003816130,1,2023-11-10 00:08:38
柠檬小奶绿,48223112,0,2,0,100,杠精真多，不如好好听歌。,可能网易云的用户流失太多了,6003777213,0,2023-11-09 23:09:29
爱杰杰真是太好了Zz,280466387,0,0,500000,500101,,哈哈,6003727166,1,2023-11-09 21:35:52
春日迟迟采繁祁祁,3305780082,33,2,350000,350100,,女孩子之间的牵绊与联系即使过了很多年，也在历史的洪流中闪闪发光熠熠生辉,6003660316,10,2023-11-09 19:25:30
抱朴bp,1440135312,19,2,320000,320100,银库的碎银子,“我将未酬的夙愿殓入这孤坟”1907年，秋瑾遇害，无一人敢为其收尸，惟有吕碧城不顾安危，偷偷拿回秋瑾尸体，将其葬在了西湖的西泠湖畔。,6003630628,209,2023-11-09 18:20:55
天將明YS,3397994055,21,1,460000,469032,一生奔赴一场大无畏梦境，世人轻慢或艳羡着你。,啊？,6003559569,0,2023-11-09 14:52:16
rachelsdream,1846237406,19,1,610000,610100,这个人很懒，什么也没有没有留下,助力,6003539340,3,2023-11-09 13:30:11
旋转不爱中,5194441890,24,1,440000,445300,孰道可死有人舍，多少葬在相离别。,你应该手指微微颤抖地在右面轻轻点个赞 傻小子,6003518462,0,2023-11-09 12:36:13
步步惊雩,8629722314,0,0,610000,610100,,这么好听的歌评论这么少，不应该呀,6003493845,3,2023-11-09 10:58:24
阿呆亦相随,310250637,23,1,440000,440100,彩虹岛我喜欢,还是好听,6003489144,1,2023-11-09 10:43:23
studyhardforthedream,1401743455,0,1,0,100,,北京场小银子表示很赞[多多笑哭],6003356817,1,2023-11-09 00:19:58
微凉杏雨,3223622361,0,2,350000,350100,,我该凭谁相认最热烈青春，渡关山重洋，逐陌路的黄昏。茫茫碧草孤城，谁唤我一生，听鸿毛入水， 沧海自起飞尘。,6003228073,12,2023-11-08 20:37:43
超人心Miles,545107241,22,1,510000,510100,,太好听了，期待巡演上能有这首,6003229899,4,2023-11-08 20:36:14
爵迹风津道,101808541,0,0,0,100,快乐就好,好爱,6003219870,1,2023-11-08 20:20:21
是西瓜呀w,1324725723,0,0,230000,230900,,好好听，为什么评论这么少,6003199624,2,2023-11-08 19:38:14
鹤芪er,1497141156,20,2,0,100,失我者永失，世间再无我,都是原装配对啊，择荇灰原穷，是风动那两位[流泪],6003176024,0,2023-11-08 18:35:13
旋转不爱中,5194441890,24,1,440000,445300,孰道可死有人舍，多少葬在相离别。,银临的歌到现在还是小家子气小家子意思[大哭],6003141903,1,2023-11-08 16:56:53
十一月也,1618068955,19,2,330000,330100,人生没有对错，只有值不值得.,助力999+，这么好的曲子不该不火[大笑],6003108882,2,2023-11-08 14:53:54
十一月也,1618068955,19,2,330000,330100,人生没有对错，只有值不值得.,“我该凭谁相认最热烈青春”,6003104600,3,2023-11-08 14:53:29
凤归_,1387371903,20,1,500000,500101,喜欢银临和黄诗扶T^T！不解释不接受反驳,我也觉得很奇怪。。但是这次的宣传已经很到位了，b站有宣传视频，微博临姐和工作室都有宣传，连巡演都是跟四专同名，眠花去甚至已经有两次线下了……不知道为什么评论这么少,6002935489,1,2023-11-08 01:05:14
-有枝-,3353464874,0,0,420000,421100,,好听好听,6002908599,2,2023-11-08 00:14:54
岑吹,1737428579,17,2,330000,330300,“众生庸俗且可爱”,“认定你我都绝非 倒悬江河中泛泛之辈”,6002870515,1,2023-11-07 23:11:50
岑吹,1737428579,17,2,330000,330300,“众生庸俗且可爱”,“你没见过我停 我奔 我将 未酬的夙愿殓入这孤坟 一个名字 归属两个偶遇的灵魂”,6002869560,7,2023-11-07 23:11:10
岑吹,1737428579,17,2,330000,330300,“众生庸俗且可爱”,“分明你我都背负 不约而同的怀璧之罪 签订在韶华的结尾”,6002869488,6,2023-11-07 23:10:22
鸣珂Rachel,4990792968,0,1,0,100,,助力！,6002822694,1,2023-11-07 21:44:37
studyhardforthedream,1401743455,0,1,0,100,,个人感觉可能还是因为古风圈缺乏足够的流量和资本推动吧，在这个快节奏的流量为王的时代，反倒是那些所谓抖音热歌更容易吸引流量播放量更高，实在是让人感到可悲。不过有一说一临姐这首歌质量还是挺高的，可惜的是缺乏流量。,6002776625,8,2023-11-07 20:12:48
南巷清风_,78733829,19,2,130000,130300,如果不爱，也请别伤害她。,太喜欢了[流泪][流泪][流泪],6002773180,1,2023-11-07 20:02:02
WLNIGHTINGALE,3899740411,19,0,350000,350100,,尽管trap成分还是流俗了 但是songwriting功底确实厉害,6002708728,2,2023-11-07 17:11:27
天將明YS,3397994055,21,1,460000,469032,一生奔赴一场大无畏梦境，世人轻慢或艳羡着你。,连古风榜都没上过[流泪],6002596280,1,2023-11-07 10:50:03
唯剑与雪,4026691768,33,0,1000000,1003500,清风来对阵,这样吗[流泪],6002596217,1,2023-11-07 10:48:59
天將明YS,3397994055,21,1,460000,469032,一生奔赴一场大无畏梦境，世人轻慢或艳羡着你。,本来就是八百多[流泪][流泪],6002596194,2,2023-11-07 10:48:19
云遮了月光,3949547387,0,2,0,100,,打卡,6002493047,1,2023-11-07 00:54:36
唯剑与雪,4026691768,33,0,1000000,1003500,清风来对阵,前几天不是1000+了吗现在怎么800+什么情况,6002492781,2,2023-11-07 00:50:42
春霖甘露,435774566,0,2,460000,460200,,终于等到了！,6002411966,1,2023-11-06 22:33:52
kylin七林,541194613,25,2,510000,510100,好听的声音会让人很开心..,好好听[流泪][流泪],6002402546,3,2023-11-06 22:20:41
lhy1629,247622259,29,0,440000,440200,,真的是好听,6002397966,1,2023-11-06 22:09:35
不肯蓝域,1479771598,21,2,410000,411000,晚夜玉衡，北斗仙尊.,盖个楼,6002324937,1,2023-11-06 19:33:30
闲方好_,474265224,24,1,430000,431100,一生奔赴一场大无畏梦境。,认定你我都绝非 倒悬江河中泛泛之辈,6002272371,1,2023-11-06 16:58:08
姜箬ya,1313350250,0,2,0,100,我的少年那样朗然，那样温柔果敢，纵容我一生天真浪漫。,好听好听～,6002267361,1,2023-11-06 16:42:36
盐梭鱼梨,557080114,0,2,0,100,“情有独钟的是轻狂年岁，独上高楼宣苍龙来会”——《焦骨》本命银临、子弥、慕寒，墙头不才、司夏、贰婶……,助力,6002258672,1,2023-11-06 16:15:54
李常超今天营业了吗,481318269,0,2,0,100,。,不知道嘞，但是这个字，很乱很乱，跟之前专辑的题字天差地别，没感觉沧海飞尘，感觉拔丝地瓜（胡乱拉丝）除非是灰原穷写的当我没说（不是）,6002255698,0,2023-11-06 16:03:25
云清晴okay,3339791116,0,0,410000,411500,,题字是谁呀，感觉还挺好看的？,6002257975,0,2023-11-06 15:59:31
夜葵w,1296487179,0,1,360000,360800,,好喜欢！,6002246428,1,2023-11-06 15:25:13
六线的谱,1429179935,0,2,0,100,,是的是的，像之前离地专是QQ那边先上线，于是我又用回了好久不打开的QQ音乐，而且今年沧海飞尘上线的时候我的关注私信没有提醒，是我卡点进主页才显示的,6002246999,3,2023-11-06 15:18:46
寒尘子,406622173,24,2,330000,330100,终是人间相逢时,999助力,6002228082,3,2023-11-06 14:17:44
MAGICSEv3N,3576929118,0,0,0,100,,神曲无需多言,6002217638,5,2023-11-06 13:48:09
动商,107140608,0,0,0,100,银临资深迷妹||忘川风华录||老古风人||时之歌时泪,助力999+，真的太喜欢了每天十遍[流泪],6002172895,1,2023-11-06 11:11:27
幽白黑乌云,286295634,0,2,0,100,词作。完整词作作品见歌单，主页显示不全，只关注私信的话其实很多歌也不会发私信的_(:з」∠)_,我觉得也有听众分流的原因，之前临姐的歌基本只有网易云有所以大家都只能在网易云听，但近几年变成很多歌只有Q音有了，所以很多听众都去Q音了网易云这边听众就变少了[多多捂脸]另外19年底网易云抽了次风，在这之前就关注的很多人会收不到新歌私信了，评论也是那个时候变少的[禁止],6002135558,9,2023-11-06 09:05:52
谓之神隐,55755153,33,1,420000,420100,,卷娘真的好棒啊啊啊这个词和临子的演唱和灰哥的曲真的，相得益彰，互相成就，这词给我听哭了都快，太伟大了呜呜呜呜呜好喜欢卷娘的词风，完美的讲述了这个发生在乱世中的巾帼故事,6002085569,2,2023-11-06 02:44:47
六线的谱,1429179935,0,2,0,100,,感觉也有宣发问题TT近几年古风的热度是这样的，不过这首是真的好听😭😭,6002004337,3,2023-11-05 23:18:49
西氿氿,1414399047,17,2,330000,330200,,卷娘你是我的神呜呜呜呜,6002002152,1,2023-11-05 23:16:20
思你如沫亦是思沫,637108448,17,2,510000,511400,时间从未停歇,好听,6001989513,1,2023-11-05 22:57:25
uiliuilibb怪,3237420515,16,1,370000,370200,,沧海飞尘这么好听怎么还没有999+ 怒了💢 先投了500云币[怒],6001950392,8,2023-11-05 21:44:51
夜雨潇潇路漫长,1658050550,0,0,1000000,1003800,,支持,6001934538,2,2023-11-05 21:16:52
盐梭鱼梨,557080114,0,2,0,100,“情有独钟的是轻狂年岁，独上高楼宣苍龙来会”——《焦骨》本命银临、子弥、慕寒，墙头不才、司夏、贰婶……,不懂为什么现在评论这么少,6001916351,2,2023-11-05 20:39:57
魔法少女千夏,264672283,0,2,1000000,1005500,越长大越享受孤独。,这歌太美了（各方面），出不来了[流泪][流泪],6001913506,5,2023-11-05 20:34:24
LetsDancewith,1652867651,0,2,0,100,让我们过分天真地爱吧,主歌把前面的氛围烘托太高了，如果副歌再惊艳一点就更更更好了[大笑]穷叔挺会写歌的，会写多写啊啊啊,6001819743,1,2023-11-05 16:35:09
焦尾儿琴,425009277,0,2,110000,110105,,火前留名,6001808249,4,2023-11-05 16:12:33
好喜欢乙帅捏,1347301413,18,2,360000,360200,作业很多,刚刚从秋瑾故居出来[流泪][流泪]“认定你我都绝非倒悬江河中泛泛之辈，是重名的乱世萍水。”,6001782904,21,2023-11-05 14:59:08
夏虫不可语冰Rachel,6424982247,0,1,610000,610100,开成花灾的玫瑰，不是灿烂，而是荒凉,好听哭了,6001782819,1,2023-11-05 14:57:56
光玉之守护,421373490,25,1,110000,110101,无论将来发生什么事情，都请不要后悔与我的相遇。,真的很爱这首。临味足，反复循环[多多大笑],6001781851,4,2023-11-05 14:55:29
光玉之守护,421373490,25,1,110000,110101,无论将来发生什么事情，都请不要后悔与我的相遇。,999助攻[好听哭了],6001777568,2,2023-11-05 14:54:32
阿允布谷布谷,352216408,23,1,0,100,合窗之前风一瓣瓣，如花雪般浓灿,银临临每张专辑都有一两首让我觉得特别的歌，四专已出的两首都好棒啊,6001772571,3,2023-11-05 14:48:21
岑吹,1737428579,17,2,330000,330300,“众生庸俗且可爱”,“一个名字 归属 两个偶遇的灵魂”,6001730725,1,2023-11-05 13:15:23
傻兔萌萌,592604068,0,1,1000000,1000100,,主歌高级，副歌抓耳，一出副歌真的想哭[流泪]不仅是两位女英雄，还有最近逝去的男英雄[流泪][流泪],6001732371,3,2023-11-05 13:13:58
长恨幽宁,4950154806,23,2,310000,310101,诗酒趁年华,梦回蚍蜉渡海,6001731337,1,2023-11-05 13:13:55
幽白黑乌云,286295634,0,2,0,100,词作。完整词作作品见歌单，主页显示不全，只关注私信的话其实很多歌也不会发私信的_(:з」∠)_,一周了，居然还没有999+[多多大哭]放前几年这是根本不可能的事情，19年左右可是十分钟999+的盛况啊QAQ那几年临姐发歌评论数都是至少4000[多多大哭],6001727568,43,2023-11-05 13:04:18
3K路公交,1924600780,23,2,500000,500101,关于我在梦里追公交车从午夜追到天亮这件事,有是风动那味儿了，DNA动了,6001708019,1,2023-11-05 12:14:39
小满啊zy,1862296868,16,2,610000,610400,苍梧白头北岸，春秋信笺俱烧与南辕。,为啥这首歌这么好听评论这么少👉🏻👈🏻我记得当时出三专的时候很快就999+了啊（这次新专的宣发真的是……）,6001678831,13,2023-11-05 11:04:43
小满啊zy,1862296868,16,2,610000,610400,苍梧白头北岸，春秋信笺俱烧与南辕。,对对对真的很感动！[色],6001668632,1,2023-11-05 10:50:32
LetsDancewith,1652867651,0,2,0,100,让我们过分天真地爱吧,这首歌的主歌部分太好听了……“时人争羡我哭我笑”这里节奏和情感的递进特别特别牛逼……相比之下，副歌的旋律有些些平庸，有点遗憾啊啊啊[流感],6001672734,19,2023-11-05 10:50:02
o它山之石o,325055438,0,2,0,100,北辰者，不为俗所移，居其所，众星遥向而拱之。,我该如何追问，最热烈青春,6001650235,1,2023-11-05 10:03:51
岑吹,1737428579,17,2,330000,330300,“众生庸俗且可爱”,“原来我们遴选过 心有灵犀的某个称谓”,6001631300,1,2023-11-05 09:10:34
白暮山,539798550,0,0,0,100,城南的花都开了。,认定你我都绝非，空耳成：想听我都止沸渡关山重洋，逐陌路的黄昏。空耳成：度半生重阳，铸末路的芳魂[西西疑问][西西疑问][西西疑问]只有我一个人空耳吗泪目[多多捂脸],6001521180,2,2023-11-05 00:35:24
薄荷茶饼,108532674,27,2,510000,510100,永远年轻 永远热爱,好听好听好听,6001513416,2,2023-11-05 00:23:10
陈伊娴,3909385341,16,2,430000,431000,少年渐行渐远到古稀 桂花载酒道不尽,好神的歌、曲、词 我何德何能有幸[流泪][流泪],6001483947,11,2023-11-04 23:37:43
千湫__,439485925,26,2,210000,210100,人不要假装不在意
除非你真的不在意
否则会有遗憾的,一如既往的好听,6001440696,3,2023-11-04 22:34:04
说不定1712,587622938,0,1,360000,360900,,彩！,6001412345,3,2023-11-04 21:38:03
studyhardforthedream,1401743455,0,1,0,100,,我也感觉这首歌很有琉璃那种大无畏勇往直前的感觉,6001373412,1,2023-11-04 20:26:36
流眄乎洛川_,1609683333,19,2,410000,410800,,好的误会了，是之前开了环绕音效[多多捂脸],6001341824,1,2023-11-04 19:01:18
流眄乎洛川_,1609683333,19,2,410000,410800,,人声在左右耳不断跳跃，仿佛有人环绕着听众，衷情诉说着她们重名的故事，很空灵，梦幻,6001333727,4,2023-11-04 18:54:41
雨花声落迟迟,566543950,21,1,510000,510100,,久违地找到了琉璃的那种感觉，忆起了高三那段时间支撑着我行走下去的美好回忆。[多多大哭],6001256418,21,2023-11-04 15:18:47
半生清阙,3372106232,17,2,440000,441300,为银临流口水,同为碧城名，共行护国事,6001251806,9,2023-11-04 14:56:14
洛洛洛rien,1736796374,0,2,1000000,1003100,洛洛是Lorien啦,还得是银临,6001204366,5,2023-11-04 12:56:16
挽江辞,1918952459,0,2,370000,371000,,太爱这首了！银临永远能在不同时候击中我,6001185655,7,2023-11-04 12:09:28
六玖cp,3270099469,0,1,320000,320100,忘了吧所有的甜美的梦,冲冲冲，昨天了解了下吕碧城和秋瑾的故事，有被触动到,6001141982,3,2023-11-04 10:02:02
猪涨价了很贵,612245377,0,2,0,100,,终于发新歌了[流泪],6001129841,2,2023-11-04 09:24:05
studyhardforthedream,1401743455,0,1,0,100,,？这是卷娘写的啊[大哭],6001121097,1,2023-11-04 08:53:03
studyhardforthedream,1401743455,0,1,0,100,,男生也很喜欢这种风格的燃歌，还有背景故事；致敬秋瑾和吕碧城两位先辈！,6001119273,1,2023-11-04 08:52:33
栗直气壮,137577180,30,1,620000,620900,,麻烦多给银临多讲点故事，就当我跪下来求你了[呲牙],6001031237,5,2023-11-04 00:37:02
天將明YS,3397994055,21,1,460000,469032,一生奔赴一场大无畏梦境，世人轻慢或艳羡着你。,确实！,6001021218,2,2023-11-04 00:22:04
一枚银子,614389625,26,1,140000,140700,银为有你，天涯比临(*˘︶˘*).。.:*♡,相比别的歌曲来说同样的音量外放声音有点低，不知道临姐有没有发现这个问题,6001023976,2,2023-11-04 00:21:11
啵灵啵灵盖,2117156881,17,2,410000,411600,社会主义好青年,临姐真的在努力为女生写歌,6001014718,4,2023-11-04 00:13:14
_千夏桃子,1645552056,0,2,0,100,他还要路过人间桃林沟一顾人间惊鸿才遇见你.✨,喜欢这个啊啊啊,6001004646,2,2023-11-04 00:02:30
你小子又幸福了,1395774228,0,2,500000,500101,约词请移步扣扣,这首歌评论咋这么点TT我觉得这首歌又是一首神曲啊！！此曲已成秒表秒了所有！应当加入以后每一场演出的歌单[流泪][流泪][流泪],6000946694,2,2023-11-03 22:20:12
终见分晓,602204278,0,2,310000,310101,奇迹只是一瞬，命运永远漫长。请允许我与你一同度过黑暗，迎接曙光。,好听！,6000930461,1,2023-11-03 21:48:36
tayslay88,9010928,29,1,310000,310101,,好听,6000918585,1,2023-11-03 21:26:04
纵苍,3281681423,0,1,430000,430100,,好好听,6000852815,1,2023-11-03 18:35:18
梦影beauty,1841811457,0,2,0,100,我在，我一直在,喜欢,6000791650,1,2023-11-03 15:32:53
烟岚离箫,512822361,22,1,350000,350100,欢乐沙雕,999冲冲冲,6000766638,1,2023-11-03 14:12:24
动商,107140608,0,0,0,100,银临资深迷妹||忘川风华录||老古风人||时之歌时泪,是谁唤我“一生”啊…她一生都在听别人唤她“碧城”，一生都会记得那个毅然奔赴生命结局的同名女子…,6000736911,2,2023-11-03 12:33:17
匀隐-允影,8506994664,0,2,370000,370100,蓝青绾。“我在君处君在我，情无尽时尽无情”爱古典文学，爱宫崎骏，爱漫画，爱安徒生童话，爱荡秋千，爱山楂酱，爱一草一木，不养宠物。爱清水般淡而有味、醇厚隽永。爱舒展的纯音，爱诗情画意的歌词。（不赶流行，喜欢的大多数歌都小众甚至冷门）想作长情且衷情的少女，温柔优雅的公主殿下。,世间所有灵魂的相遇都是久别重逢，你我的名号如共同拥有的信物，引导我们在人海找到彼此，望向你时，灵魂认出了对方。,6000686349,3,2023-11-03 10:05:15
