言柒_en,3238725858,0,2,370000,370900,喜欢海，喜欢花，喜欢日出和日落，浪漫的年纪别活的太无趣这里是言柒，性格温柔内敛，甜美少女音，喜欢听音乐和聊天📋，欢迎来找我丸吖～❤粉团7级可+v，也可相约王者峡谷～直播时间4:30pm之后,没想到能在这里遇见你,3435131531,1,2020-08-26 19:12:13
言柒_en,3238725858,0,2,370000,370900,喜欢海，喜欢花，喜欢日出和日落，浪漫的年纪别活的太无趣这里是言柒，性格温柔内敛，甜美少女音，喜欢听音乐和聊天📋，欢迎来找我丸吖～❤粉团7级可+v，也可相约王者峡谷～直播时间4:30pm之后,珺雅！[多多大笑],3435147458,1,2020-08-26 19:11:59
钰鹤_HtAN,3234051857,0,0,510000,510800,,你是魔鬼么！,3434949673,0,2020-08-26 16:17:16
钰鹤_HtAN,3234051857,0,0,510000,510800,,你是魔鬼么[呆][呆],3435029873,0,2020-08-26 16:16:45
言和辞辞,1810170902,0,1,320000,321000,,总有一些人,3434914438,0,2020-08-26 15:24:01
定居猫街,2125735692,0,0,310000,310101,我太脆弱了，我上辈子一定是片海苔,我也是,3434883557,0,2020-08-26 14:57:30
欧利蒂丝庄园在逃侦探,1926259710,0,0,0,100,被第五拿捏了（笑）,我也是，，，想吃鱼了,3434660259,1,2020-08-26 10:33:37
吃了益达的炫迈,60593925,26,1,350000,350600,无声的岁月 偷走我好多的梦,真讽刺 重复的几个调被说成抄袭 这个好几年前就澄清过了现在还来黑。。。,3434340782,1,2020-08-26 00:33:07
子非倾河,3220567391,26,0,210000,210200,灵感生长于痛苦,吹梦到西洲？,3434229870,0,2020-08-25 22:09:47
子非倾河,3220567391,26,0,210000,210200,灵感生长于痛苦,a.Pav？,3434235807,0,2020-08-25 22:08:57
肥璐璐_CIGF,2133200823,0,2,320000,320100,,看宣璐艺术体操种草的,3434135286,3,2020-08-25 21:35:49
眼中永远有星辰大海,1605548135,21,2,310000,310101,,上次听这首歌的时候我养的黑色金鱼还活着，它对每条鱼都很友善，还很活泼，会亲我的手指。但是昨天换水的时候温差有点大它没适应，今天中午的时候挂了，现在只能再听这首歌怀念一下。下午去花鸟市场有看到它的同类，但没选择买，看了伤心。虽然有外形相似的鱼，但我总觉得它就是它，任何鱼都不能代替。,3434074522,2,2020-08-25 21:11:39
嘉松所向,1370145045,18,2,310000,310101,2006年美国周刊年度风云人物2008年感动中国组委会特别大奖2009年年度地球卫士奖2022年奥林匹克杯获得者,说实话，我是从b站来的,3434022600,3,2020-08-25 20:39:13
想起个牛皮的名字但网易不允许,3262852481,16,1,0,100,,有的时候有些事情不知道结局更好。,3433980779,4,2020-08-25 20:12:18
西一口儿,255891696,23,2,120000,120101,学会一首一首,有一个“我梦到那天”,3433998221,0,2020-08-25 19:41:16
熠熠生菲-YIF,1912343336,0,2,330000,330100,,上次听锦鲤抄的时候我的猫还在，转眼已经丢了快2个月了。那个时候中二的想象我的猫是一只猫妖，脑补了不少奇奇怪怪的故事。现在只希望她还能回到我身边，虽然我知道那不可能。以前看到别人猫丢了都不以为然，现在，唉……,3433884575,9,2020-08-25 18:27:54
giao_PE12,1889860980,0,2,210000,210100,,江厌离太草了,3433894977,0,2020-08-25 17:50:06
Twilight_TU2v,1370860348,0,2,0,100,,may i see you again ？,3433890849,1,2020-08-25 17:26:31
岁岁盛今朝,1994088830,0,2,130000,130700,,我没听清说的什么……呜呜呜(┯_┯),3433822379,0,2020-08-25 17:18:25
silkyguan,1719715973,0,0,510000,511500,,写得我都饿了[汗],3433594316,0,2020-08-25 13:51:45
行者_________,1478135167,0,1,220000,220600,,我叫浅溪，是个画家，在这小城颇有名气，城中时常有人来求画扰了我原本清静的生活，后听闻落败的张府要出售祖宅，我便买下了，城中人皆劝我张府不祥，需慎重，可我孑然一身，也没什么好怕了，还可以落得个清静。搬进张府的那天，发现府中东南角有一小池，池水清澈，据老主人讲，之前这里有一眼泉，遂,3433596942,1,2020-08-25 13:24:48
行者_________,1478135167,0,1,220000,220600,,我是一条锦鲤，自打我记事以来便住在这张家大院的小池子里，我也不知道在住了多久，只记得张府以前是这城中最繁盛的府邸，也不知道到了哪一代便凋零了，如今这落大的府邸空空荡荡，冷冷清清的。我倒是习惯这般清净了，或许张家人也不喜池中物，这池子里除了我一条锦鲤也就剩一些小鱼小虾米了。,3433598957,1,2020-08-25 13:24:36
Li政波,1325741262,0,1,360000,360700,,喜欢诗词的朋友来vx看看一抹云诗词,3433382478,1,2020-08-25 11:28:01
悸动_JkJU,1416367308,0,2,0,100,̊追风赶月莫停留，平芜尽处是春山.,嗯,3433444100,1,2020-08-25 11:23:51
洛书途,449721227,0,2,370000,370100,,可惜临结婚了对方不是泣,3433355181,0,2020-08-25 10:45:18
洛书途,449721227,0,2,370000,370100,,啊啊啊啊，哪里漫展有银姐现场啊，我这边一次都没有……,3433321221,0,2020-08-25 10:44:16
月下葬剑,3718220613,0,0,340000,340100,,一生之敌。灰原穷,3432892142,3,2020-08-24 23:09:03
芦笙o,431607069,0,0,0,100,我喜欢的歌手是周深，他唱歌很好听,谢谢,3432530734,0,2020-08-24 19:03:49
橘子味的卷,382467319,0,2,0,100,,第一段是银临，第二段是云呆~,3432558856,1,2020-08-24 18:13:03
苏尔伯特,534292495,29,1,320000,320500,总有一些日子，你会读着星空的语言，直到天亮,原来诀别是因为深藏眷恋、、、,3432218294,1,2020-08-24 13:27:12
芦笙o,431607069,0,0,0,100,我喜欢的歌手是周深，他唱歌很好听,想知道哪些是银临唱的？哪些是云之泣唱的？,3432258818,3,2020-08-24 13:24:38
天仙霉,1660839662,20,1,510000,510100,你走了很久，夜黑了又亮，人走了又来，我一直没离开，还在傻傻等你，可是我马上要走了，以后，如果你忽然记得回来了，找不到我，就算你活该吧。我没那个运气，也没那份实力，去走一走世界，好过深陷人心。,酸嘛～你爱你的，别人爱别人的，你来找存在感吧，无语O__O"…,3432107731,1,2020-08-24 12:24:06
是非在己鸭,2095986034,0,2,610000,610100,,天官粉吗,3432135383,0,2020-08-24 12:14:52
PAN-JT,1571129491,0,1,0,100,往前走,算是我古风歌的启蒙作了吧[多多大笑],3432042090,4,2020-08-24 10:10:00
25時全肯定bot,510787085,0,2,320000,320600,本质25团推，但这跟白石杏是我老婆又有什么关系呢。,自己喜欢的作者的歌粉丝们当然是刷自己喜欢的作者。,3431973502,1,2020-08-24 09:27:33
25時全肯定bot,510787085,0,2,320000,320600,本质25团推，但这跟白石杏是我老婆又有什么关系呢。,你可以自己去刷云之泣，都随你，但你不能不让别人刷银临,3432038811,2,2020-08-24 09:26:24
polSa,1433563185,0,1,210000,210200,,鄙人与某四手联弹过此曲，当时不解其中意，再闻已是曲终人,3431609222,3,2020-08-23 22:20:32
岁岁盛今朝,1994088830,0,2,130000,130700,,你你听出来了',3431538197,0,2020-08-23 21:30:25
Cassie要开森,338161430,25,2,370000,370200,,望此生平安顺遂,3431491833,3,2020-08-23 20:28:24
悸动_JkJU,1416367308,0,2,0,100,̊追风赶月莫停留，平芜尽处是春山.,有的诶！,3431247592,1,2020-08-23 17:58:23
愿长安常安啊,3396621435,0,2,130000,130600,,这是五年级上册学的，作者是林升，南宋的林升,3431220486,1,2020-08-23 17:23:01
醉耶梦耶,1744691585,20,1,1000000,1010000,,别带歪人家了，什么文言文版。白话文而已，再夹杂点单音节词，文言虚词居然一个没有……算了，你喜欢就好,3431180685,0,2020-08-23 17:05:52
皆zone,3264094863,0,0,0,100,,哇哇,3431191484,0,2020-08-23 16:55:35
森霭茶,1368472024,16,2,310000,310101,snow white永远滴神,放翻唱倒也没什么，但“这不是原唱吗”也太气人了吧,3431161828,10,2020-08-23 15:19:39
一枚银子,614389625,26,1,140000,140700,银为有你，天涯比临(*˘︶˘*).。.:*♡,这首歌是临姐的梦境，什么时候就游戏了,3430902708,0,2020-08-23 12:48:07
Purewhitejasmine,2087847780,0,2,420000,420300,每天都要开开心心的鸭～,同城,3430943174,0,2020-08-23 12:25:09
没有想过想要用网易云哎,531779717,0,1,810000,810100,,原来如此…怪不得听起来声音显得寡淡(？),3430945049,1,2020-08-23 12:18:10
-热带季风,440348319,21,1,530000,530100,本人喜欢收集各种梦里发生的故事，亦或离奇，亦或温情，亦或怪异，亦或难解，只要能分享给我，我都会认真听完且做好记录（我觉得有意思的就会以你们的网易云ID记录下来），只限于梦里的故事哦，如果在评论区看到我，想说故事的直接私聊我，看到都会回，待故事多起来，日后有条件的话，就出本书吧,五十六个润土，五十六只猹，五十六个闪亮钢叉放你家，五十六个西瓜，全都不见啦，叫你偷瓜，叫你偷瓜，叫你偷瓜,3430749514,2,2020-08-23 09:49:15
早春倒冷回寒,1832651570,0,0,0,100,Lucifer， Daydream， Dime novel， Mirage， Doomsday Carnival， Scarlet， Romantic，Smooth Criminal，Gojo Satoru，Blue bird.,那个白话文省了很多情节,3430781131,0,2020-08-23 09:38:08
我真讨厌数学物理,416698703,19,2,340000,340100,,小升初那年最喜欢的歌 转眼都是四年了 [多多大哭],3430505234,3,2020-08-23 00:15:10
都给我去听三无和憨色的好汉歌,1479803414,18,2,440000,440100,一以贯之的努力，不得懈怠的人生。,听了一圈发现还是原唱厉害,3430485911,3,2020-08-22 23:41:37
泠度LL,1713502607,19,2,1000000,1006900,,哈哈哈哈哈哈哈哈哈哈哈哈哈哈哈哈哈哈哈哈哈哈哈哈哈哈哈哈哈哈哈哈哈哈哈哈哈,3430251163,0,2020-08-22 21:16:09
Zerai_,1667666159,19,2,320000,320400,第一万零一次日落🌇,我也是，啊啊啊现在还会唱,3429805086,0,2020-08-22 14:38:30
小叮咚1,3857764416,0,1,0,100,开心快乐每一天,喜欢😍,3429788994,2,2020-08-22 14:05:46
梦颖依蝶,1359943449,0,1,0,100,,那是后来游戏联动的好吧,3429588201,0,2020-08-22 11:26:41
梦颖依蝶,1359943449,0,1,0,100,,√,3429525745,0,2020-08-22 11:26:14
比全世界富有,537652264,0,1,130000,130100,,不是，这是原创曲.....不过后来和天刀联动了,3429458367,7,2020-08-22 09:24:38
仿生鸽子是否会梦到电子咕咕,2013405270,0,2,0,100,不知名鸽子,那啥，抄才是日本人文体。歌曲页面，右下，圆圈圈着的三点，点开，点专辑，然后右上向右的一个剪头，点开是文案，讲的就是锦鲤的故事。,3429301760,2,2020-08-22 04:40:36
画未画,1706585031,0,2,330000,330100,,嗯你说得对，可在这里说就不对。,3429243666,0,2020-08-22 01:25:29
画未画,1706585031,0,2,330000,330100,,钓鱼？,3429303989,0,2020-08-22 01:24:28
画未画,1706585031,0,2,330000,330100,,都0202年了，还有说锦鲤抄是抄袭的，也是服了。,3429275277,1,2020-08-22 01:24:01
一株银柳,396285254,0,1,420000,420100,,因为她本来说话声音就很小[多多捂脸]，这声音还是调大了点,3429130058,1,2020-08-21 23:08:50
晴天MHY-,1997031751,0,2,370000,371300,原来深情是可以装出来的,只为听第49秒，只因他叫陌上桑，只是他不属于我,3429073416,3,2020-08-21 23:02:48
少爷什么的,83847233,3,2,130000,131100,海胆家族来的。,动用你智慧的大脑想想锦鲤抄也不可能是文体啊哈哈哈 笑死我了 锦鲤抄在日语就像小石谭记的格式好不,3428980703,2,2020-08-21 22:27:16
少爷什么的,83847233,3,2,130000,131100,海胆家族来的。,……哥们你别明明说错了还看大家都煞笔吧  抄的确是文体  锦鲤抄 基本就是锦鲤传的意思  神tm锦鲤抄是文体 锦鲤抄搁日语翻译一下就是锦鲤的故事  你真是个新型奇葩  小火汁多看看书营销号少看,3429013425,3,2020-08-21 22:25:10
少爷什么的,83847233,3,2,130000,131100,海胆家族来的。,按你这个解释也说不通这首歌这个mv   你说错了就“我懒的争”  你有啥好争啊?,3429036114,3,2020-08-21 22:16:36
子不说,47135150,28,1,350000,350200,快乐，快乐，还是要快乐！,日常单曲循环,3428884559,2,2020-08-21 21:13:00
runway1507,35423604,0,0,420000,420700,,嗯，也感觉很像各种电视剧的歌曲。中间一段什么乐器，浓浓电视剧感觉,3428795485,2,2020-08-21 20:05:06
冷夜姬无情,1872394875,0,1,130000,130600,,秀儿,3428722840,0,2020-08-21 17:52:53
嘉松所向,1370145045,18,2,310000,310101,2006年美国周刊年度风云人物2008年感动中国组委会特别大奖2009年年度地球卫士奖2022年奥林匹克杯获得者,什么游戏？,3428623312,0,2020-08-21 17:19:15
_陳離,278338996,0,0,0,100,,啊这，评论区都是什么，这首歌只是一个游戏的曲子而已..,3428478377,3,2020-08-21 15:12:39
俺不是小雪生,2127235729,19,1,220000,220100,哈库呐，玛塔塔！,看了一下评论，说什么的都有，感觉大家都好厉害啊，懂得可真多。我没你们那么有文化，只知道好听就行！,3428312636,3,2020-08-21 13:09:10
阳光橙色好,1444747489,33,1,340000,340100,我爱我,云泣,3428343999,0,2020-08-21 12:48:22
最大的一坨鼻屎,1811379571,0,1,0,100,取名字好难，写简介更难,闺猹抄,3428085731,0,2020-08-21 10:25:54
少爷什么的,83847233,3,2,130000,131100,海胆家族来的。,这首歌就是说的锦鲤啊   你觉得古风歌可能有日语词汇么…大家都不傻,3428047395,8,2020-08-21 08:59:32
破旧窗户破布补,307996739,0,1,0,100,杨柳初生风中曳，折扇频挥悲秋月。,车祸就是车祸，不好就是不好，不好改正就行了，别说这种扯蛋的借口，太下乘,3427872866,0,2020-08-21 00:40:28
墨玦_o6cW,1756137723,0,1,430000,431200,,这首歌都已经开始被人污染了吗[皱眉],3427659740,3,2020-08-20 23:39:50
汤-圆儿吖,370127426,0,2,610000,610700,只可自心悦，不堪以赠君 很高兴认识你,银临姐姐越来越好啦,3427745865,0,2020-08-20 23:32:56
香草味布丁粉,3317183989,17,2,0,100,智者不入爱河，寡王一路硕博，冤种重蹈覆辙。,说出来你们可能不信：我在网易看小说🌚,3427627954,1,2020-08-20 22:26:22
香草味布丁粉,3317183989,17,2,0,100,智者不入爱河，寡王一路硕博，冤种重蹈覆辙。,为什么啊？求解释(ﾟOﾟ),3427561526,2,2020-08-20 22:25:14
沫枫-人呢,1794630915,21,1,410000,410500,可爱而帅气，哇，我好自恋,魔鬼,3427380048,1,2020-08-20 19:47:13
xxx_sinkwithink,1294973062,0,0,340000,341700,,时代的眼泪……,3427337286,3,2020-08-20 19:31:58
小吴同学今天早睡了吗,2110698208,19,2,420000,421300,快乐的秘诀是停止胡思乱想,@biu嚯嚯嚯,3427195750,2,2020-08-20 18:06:12
乱把白云揉碎_X3rV,1926060377,0,0,340000,341300,,叙世好听,3426696351,2,2020-08-20 10:08:35
sx迪迪平安喜乐,3277880757,18,2,1000000,1010000,盗墓笔记,我感觉这首歌开头那个伴奏就是很治愈的感觉。让我想起了特别开心的画面[憨笑],3426628444,8,2020-08-20 09:12:25
藤儿w,404458225,0,0,510000,510100,,哈哈哈哈哈姐妹又是你，咱们喜欢的东西怎么重合率这么高www,3426462558,1,2020-08-20 02:41:05
密西西比k5,268115211,0,2,510000,510100,,听了银临现场的意难平，挺稳的,3426484976,0,2020-08-20 01:30:33
穿小裙子的喃娃,1551089129,0,1,0,100,,大师哦 我猜你连歌词都没认真看[憨笑],3426029280,2,2020-08-19 21:19:42
峰峰再不疯,1321266111,0,0,420000,420100,,不能呆池塘里？？,3425919040,0,2020-08-19 19:39:30
婉卿____,3343340929,33,2,130000,130100,,秀,3425705163,0,2020-08-19 16:57:33
茶刃-,1645498729,0,0,0,100,努力成为一个优秀的人,入古风圈就是因为这首，转眼都这么多年了……,3425721943,10,2020-08-19 16:50:26
还有名字没被人用过吗,1514956978,0,0,350000,350100,,魔鬼[大哭],3425208339,0,2020-08-19 09:48:10
韩国财阀的网易,1395070656,19,2,370000,370100,,这首歌在我上初一的前一天我姐姐让我遇见了它 我当时也没有感觉很好听 开学第一天遇到了第一个喜欢我的男生现在我马上就高二了 说不出的怀念,3424785645,3,2020-08-18 22:57:12
开空调也很热,490736519,0,1,0,100,,你的小学生活好丰富,3424840103,0,2020-08-18 22:55:42
江清川,3380366108,0,0,500000,500101,,啊你们理智点，人家也是粉，我感觉你们很多人敌意很大啊,3424770088,0,2020-08-18 22:07:44
忘掉蓝忘机,1539955241,15,2,430000,430400,不要惊动我爱的人，等他自己情愿,@黑人20号 你听开头好像是二胡吧，那一段绝了（依然小学听的）,3424749992,3,2020-08-18 21:50:27
大王毎,65573346,0,0,440000,440100,,这首歌有一丢丢难唱，前面一直唱不下去,3424449403,4,2020-08-18 18:24:58
_奉惟_,1765524960,0,1,610000,610100,桐花万里关山路，孤灯千盏不归途。自以为心若磐石，而人却终非草木。,天仙配,3424359136,0,2020-08-18 17:00:39
比全世界富有,537652264,0,1,130000,130100,,人皆文学大师[强],3424343349,0,2020-08-18 16:57:51
蒹葭_lBwk,3827091800,0,2,0,100,喵,猹是 獾，它的肉不能乱吃,3424343995,0,2020-08-18 16:27:12
橘唐茶,1401493110,0,0,0,100,不哭,姐妹偶遇？哈哈哈哈,3424277514,0,2020-08-18 16:26:20
蒹葭_lBwk,3827091800,0,2,0,100,喵,炒鲤鱼是锦鲤抄的外号,3424292492,0,2020-08-18 16:24:12
BE_NO_MORE,1353383837,0,2,0,100,wubba lubba dub dub.,果然我当年的听歌品味不错，爱的古风歌都火了，哈哈哈哈哈哈哈哈哈哈,3424090790,1,2020-08-18 13:44:01
星星水手哇,3251639428,0,0,330000,330600,,刚在另一个评论区看到,3423277494,2,2020-08-17 20:17:25
每天失忆,260186658,0,0,0,100,你看起來好像不太開心,许多许多年了,3423185755,1,2020-08-17 19:30:13
黄油-猫永动机,3231909129,0,2,420000,420100,,我的初心[爱心],3423121361,3,2020-08-17 17:57:47
舟渡_KpDO,1781386316,0,2,530000,530700,,讲个鬼故事，临姐老公是灰穷原,3423047472,5,2020-08-17 16:54:37
一朵大晴花儿,3259745568,0,1,0,100,好戏啊都在烟火里,此生惟愿 来去如风,3423044427,4,2020-08-17 16:52:35
江風晚曦辞,1655915742,19,1,440000,441400,春风烟雨化骨寒，半面红妆落青峰,全诗是《题林安邸》山外青山楼外楼，西湖歌舞几时休。暖风熏得游人醉，直把杭州作汴州,3422936935,2,2020-08-17 14:15:53
切尔咪,3260868135,0,2,430000,431200,,治好皇上旧疾的药师拒绝了皇上的赐婚，只是从画室里拿了一副很不起眼的鲤鱼画作为报酬。世人皆道她愚蠢无比，可又有谁知道，这幅画对她有多重要。药师去世那天，画被她死死攒在手中。只有她知道她对着这幅画哭了多少次。“阿鲤，我来找你了。”“嗯。”,3422853357,1,2020-08-17 13:37:29
忘川风华录marblue,1504202592,0,2,0,100,,红警啊,3422862932,0,2020-08-17 13:03:50
WINWIN_WONWON,1598220956,0,2,0,100,只是你 一回身我会放下全部,山外青山楼外楼，高考争取双一流,3422749523,5,2020-08-17 12:12:58
溯剧,1857017386,16,2,370000,371300,嬷是一种态度,你可以听听火锅抄哈哈哈哈哈哈调调一样的哈哈哈哈哈哈哈哈哈,3422679218,1,2020-08-17 10:39:36
讓這顆心靜靜逃掉-,3398486428,0,0,0,100,,普通人是这样再正常不过，但是拿来当饭碗的就必须稳，这叫业务能力（鄙见，勿喷）,3422517262,0,2020-08-17 05:50:54
言兔子,1335785605,24,2,350000,350500,不开心的时候记得听歌,超新星运动会上听到的，太好听了吧,3422327778,1,2020-08-17 00:17:48
亦深亦浅亦近亦远-,1492266486,0,2,440000,445100,,记得我去读初中的前一天收拾宿舍，播的就是这首，一直都是满满的回忆。,3422339136,3,2020-08-16 23:36:25
天痕星空,390027801,0,1,120000,120101,,[多多可怜],3422252526,1,2020-08-16 23:09:46
温苓瞳,1999454271,0,2,430000,431300,,爱好嘛，如果你接受不了的话，就当做没看见，可以吗？,3422204575,0,2020-08-16 22:41:14
还是阿狸吖哈哈,123624383,27,2,370000,370100,也许你我终将下落不明，但你该知道我曾为你动过情。,谢谢好心人的抱抱,3422154774,1,2020-08-16 22:23:13
瀿熒,247263184,0,2,410000,410100,,不是……这和本歌有啥联系吗,3422252805,0,2020-08-16 22:20:32
林水一程,504101659,21,2,320000,320300,我永远爱盗墓笔记,建议宁先看看宁自己评论的什么再说吧，理解能力宁自己提升去吧,3422215975,4,2020-08-16 22:06:31
xxy99-,1489227378,0,2,0,100,别轻易说分开,你愿意每天听我讲废话 我就愿意每天爱你,3421872342,3,2020-08-16 17:48:59
蜜寧_TXOG,1514681961,0,1,530000,530100,愿你被这个世界温柔以待,呵呵,3421808715,0,2020-08-16 17:21:11
蜜寧_TXOG,1514681961,0,1,530000,530100,愿你被这个世界温柔以待,请不要把你自己的意见作为道德的准则，请你爬谢谢,3421846238,7,2020-08-16 17:19:13
Wind-Libra,3295691065,0,2,1000000,1002000,让人类保持理智，果然是一种奢望。,两首歌作词作曲是一样的，我是表达讽刺啦,3421730295,0,2020-08-16 15:34:43
形山良刻,1483583319,18,0,330000,330800,只是心中枷锁，该如何才能解脱。,但是不管职业不职业都会紧张。。。,3421714809,0,2020-08-16 14:17:12
Ansettled,1653191586,0,1,310000,310101,,oier 看到 顶一下吧,3421649078,1,2020-08-16 13:45:36
冰糖雪梨炖豆腐咸鱼煨蒜头王八,1605931459,0,2,0,100,水逆ing,第一次听到这首歌的时候是在联盟好声音悟空和阿狸那一期没想到已经过去好久了,3421475582,1,2020-08-16 11:48:58
inserlal,3573310195,1,2,440000,440100,啊啊啊啊啊啊啊啊,……你们城里人真有文化呵呵,3421455713,1,2020-08-16 11:42:24
逾期仍候,1333795048,17,2,430000,431300,生活还是需要一点仪式感的,[大哭],3421478536,1,2020-08-16 11:35:42
月亮和烤五花肉,48562218,0,2,0,100,一了百了，互不相欠。,刚才听到某某的一首新歌感觉里面几个地方特别像这首歌，跑过来听听一翻留言又看到说这首歌和某日文歌相似[汗],3421270991,2,2020-08-16 02:14:58
执剑SSR,291751666,0,0,0,100,Stand with me.,啊～～～～～,3421236131,2,2020-08-16 01:35:30
心平200331,3266466739,0,2,0,100,,让我看看是谁这么把自己当回事，哦原来是高贵227啊，那没事了,3421020381,0,2020-08-15 22:55:09
丶______丶,1569628417,0,1,330000,330700,,´ཀ`_阿巴阿巴,3420805385,0,2020-08-15 20:43:23
心似孤月月明熙,337278584,23,1,110000,110101,浓情烈酒不敌你嫣然一笑,真心不真心也不重要了、已经散了,3420628990,0,2020-08-15 17:29:34
DULM_,1883553587,0,2,0,100,我们不是只有现在吗,啥瓜,3420471247,1,2020-08-15 15:38:07
安然若北,560221283,0,2,0,100,生当复来归，死当长相思。                            你会遇见更好的人，但不会遇见第二个我。,怀念初三唱这首歌给我听的你～高考之后各奔东西 未来可能再也没有这个机会了 lrx 希望我未来看到这个缩写还能想起来是你吖……,3420493045,2,2020-08-15 15:29:06
anyuanlan20041111,3286591679,0,2,0,100,业 ！余 ！翻 ！唱 ！小 ！白 ！,叫秀儿,3420343474,2,2020-08-15 13:59:30
anyuanlan20041111,3286591679,0,2,0,100,业 ！余 ！翻 ！唱 ！小 ！白 ！,狠人,3420317695,2,2020-08-15 13:52:28
泛音er,381038219,0,2,320000,321100,爱二次元～爱古风～,好适合夏天听的歌啊,3420256947,6,2020-08-15 11:49:26
Encuentro___,1350850427,0,1,0,100,,回,3420150058,1,2020-08-15 10:18:48
糖果的劫,3277779327,15,2,440000,440100,如果说我不曾见过太阳，撕开云雾，你就是光,“请不要把耳机勒在脖子上😌”,3420027425,5,2020-08-15 08:47:20
_清风不过如此,528461157,21,1,450000,450300,,以前的银临嗓音特别甜美,3420077829,2,2020-08-15 08:14:46
空心菜190314,1793915341,0,1,440000,440300,,入坑曲,3419714381,2,2020-08-14 23:26:51
别致的枫子,476363252,21,2,150000,150100,你听风吹 我等你归,我也 但是可惜少锦第三季没有了踪影。。,3419687691,0,2020-08-14 23:23:55
锦鲤肥宅,508377760,0,2,0,100,“穿越百夜，仰望千空”,我我我！我真的哭了，虽然我先听的锦鲤抄，然后再追少锦第一季，没想到格局都还没展开就死在腹中了,3419542506,0,2020-08-14 21:41:37
别致的枫子,476363252,21,2,150000,150100,你听风吹 我等你归,有人知道少锦吗,3419391317,2,2020-08-14 19:42:56
别致的枫子,476363252,21,2,150000,150100,你听风吹 我等你归,歌先出的,3419378473,1,2020-08-14 19:42:37
别致的枫子,476363252,21,2,150000,150100,你听风吹 我等你归,少锦,3419446833,1,2020-08-14 19:41:41
乱音樂,35679862,0,0,440000,441400,,白居易牛逼,3419334163,2,2020-08-14 18:34:58
PleaseStandingTheBy-A-Scan,122678502,33,1,1000000,1003100,AIG...,鲤鱼啥味的，我是说彩鲤啥味的，,3419106814,0,2020-08-14 14:32:47
诗里寻坞,1718267484,0,0,340000,340200,只要你还在身边,她不是啊，转型什么的都是后来的,3418884237,0,2020-08-14 11:55:40
Wind-Libra,3295691065,0,2,1000000,1002000,让人类保持理智，果然是一种奢望。,我是讽刺跟风说抄袭的意思啦～,3418840074,1,2020-08-14 10:54:09
北辙以南,315282663,0,1,440000,440600,,中间有为押韵而乱改的  不过现在很多歌都是这样,3418825214,4,2020-08-14 10:53:35
北辙以南,315282663,0,1,440000,440600,,了解了典故了。 可还是在堆砌词组,3418863823,4,2020-08-14 10:53:09
尼科诺夫94式,281580727,0,1,450000,450100,现在的我丝毫不比那时的我聪明,来人，剥了袁小棠的飞鱼服和绣春刀doge,3418782483,1,2020-08-14 10:43:20
帐号已注销,1687691213,无,无,无,无,无,抱抱,3418769355,0,2020-08-14 10:14:36
