阿哩阿li,1517574744,22,1,410000,410100,孤独烈酒一支烟。这些我都没尝试过。,以前那个霸占了好几楼的评论删了。[多多捂脸],3444941082,0,2020-09-05 11:58:14
谢黎迟,3265755550,0,0,0,100,结束 over,捉到一个水评的,3444845665,0,2020-09-05 11:20:23
摊煎饼吃,246887283,0,2,140000,140100,,我也这种感觉，听前几个字就知道后几个字啥调调儿,3444869022,0,2020-09-05 10:17:12
红豆_YiV6,287258340,24,1,370000,370200,你指尖跃动的光是我此生不灭的信仰,怎么感觉在哪里听过。但是不一样又。哎，好多歌都有这种感觉。歌听多了就这样吗[大哭],3444784567,2,2020-09-05 09:42:40
原地鬼畜,403653420,33,0,130000,131000,,上一次主动听中文歌是什么时候来着……,3444543559,1,2020-09-04 23:43:26
生而为人民服务-我很光荣,2130292312,0,0,0,100,,小鲤鱼，模样真神奇，活蹦乱跳滚了一身泥~,3444544129,1,2020-09-04 23:09:22
GG还开,2018345383,16,1,500000,500101,音乐是最好的药剂,单数,3444444872,0,2020-09-04 21:32:24
柒贰贰陆,514121932,21,1,130000,130100,这个人极其懒惰，什么都没留下。,没有为什么，他们喜欢找存在感而已，不过盗将行是民谣确实不算古风，不过没有高低贵贱之分。我觉得只要不是抖音那种毁歌都不算什么,3444227837,6,2020-09-04 17:28:05
江山别袂,623608114,21,2,1000000,1000700,听客,裙袂不经意沾了荷香，从此坠入尘网～,3444146579,0,2020-09-04 17:19:49
青衣一顾红衣二祸,1445365549,0,0,350000,350400,,海底月是天上月，眼前人是心上人,3443992330,0,2020-09-04 12:41:24
那年我把桃花切二斤,307139468,0,1,0,100,要对线就对线  别整pxj那套拉黑 真是有够好笑的呢,老子怕不是要从棺材里爬出来,3443876400,0,2020-09-04 09:35:38
一班张总,1562400153,0,1,440000,440600,,有点饿了,3443855315,0,2020-09-04 08:36:35
ArtemisViolet,379713428,0,2,0,100,桃李春风一杯酒，江湖夜雨十年灯,想起来了16年那段美好的日子,3443627701,1,2020-09-03 23:08:42
-如歌彻婉颜-,1689314960,0,2,0,100,“ 你无意却早已自然的 成为我无止境的灵感。 ”冬愿厮守，夏也长等❤️,临临云姐我都爱，喜欢谁就表白谁就好了,3443497389,2,2020-09-03 20:17:30
-如歌彻婉颜-,1689314960,0,2,0,100,“ 你无意却早已自然的 成为我无止境的灵感。 ”冬愿厮守，夏也长等❤️,第一个银临，可以去百科查查,3443526967,0,2020-09-03 20:16:00
阮cha-,1561602940,17,2,220000,220700,…,@常杰CJ_ 一定要把这层的回复翻一遍，笑死了哈哈哈哈哈,3443476540,0,2020-09-03 20:11:17
子不语-聆听之乐,2089208329,0,1,0,100,,夜雨青灯，长夜难明,3443338661,1,2020-09-03 17:22:08
四之日初九,305901764,0,2,420000,420100,,梦开始的地方,3443304470,0,2020-09-03 15:55:41
欣依嘿,1653935671,22,2,110000,110101,我是叫我小小小姐，请多关注啦！,还算数吗双数,3443285683,0,2020-09-03 15:47:10
昨夜似星河入梦,327110002,17,1,350000,350500,我将玫瑰藏于身后 止不住蓄谋已久的冲动 花瓣凋落于泥泞之中 你我终究是过客,我音盲了？有没有谁能告诉我哪个是哪个唱的？,3443206125,0,2020-09-03 11:45:19
A-angel2002,3225358328,0,2,210000,210100,,如果来生太远寄不到诺言不如学着放下许多执念愿君此生安好,3443058782,2,2020-09-03 08:11:23
bui-_2zov,1945153074,0,2,340000,340400,,我觉得这首歌好适合《砂与海之歌》,3442813373,3,2020-09-02 22:08:07
GG还开,2018345383,16,1,500000,500101,音乐是最好的药剂,May L See You Again,3442717513,1,2020-09-02 20:31:57
阿哩阿li,1517574744,22,1,410000,410100,孤独烈酒一支烟。这些我都没尝试过。,王者,3442692956,0,2020-09-02 19:03:13
A-riay,1931601490,17,2,330000,330100,人们数不清她的屋顶上有多少轮皎洁的明月,所以我说什么了？我只是说“难道不能评价吗”我骂她了？你看什么看不下去？,3442603720,0,2020-09-02 18:42:11
xisui呀,442603364,0,2,230000,230100,,这是异闻录里面的记载…,3442511937,0,2020-09-02 13:20:24
开心的我和月亮以及-,1375559834,0,2,0,100,,典狱司！！我爱！！一听就哭系列,3442309762,1,2020-09-02 09:52:41
锦朝万里,326159217,21,2,500000,500101,却难以抗拒流星的宿命,这是古风歌曲的里程碑之一啊,3442259703,3,2020-09-02 08:12:57
用户1604051149,1604051149,0,2,510000,510100,,你们的故事情节从哪来的，求推荐[亲亲],3442293328,0,2020-09-02 06:48:42
云倾封耽,1547545845,0,2,0,100,,银临毕业于南京大学英语系，没有专业学唱歌，她发展方向是作曲，什么才华想必你们也知道，大火的歌全是自己操刀作曲，唱功不算好，早期现场是车祸，紧张肯定有，但确实是唱功不好，没什么可解释   搬了个评论回复，因为看不太下去了,3442079646,2,2020-09-01 23:03:03
The-Evildoer-,1487378989,0,1,510000,510100,,吹梦到西洲古文典故特别多，不建议古文不精的孩纸生拉硬拽的翻译与理解，基本就是一篇长篇古文了,3442011769,7,2020-09-01 22:15:35
The-Evildoer-,1487378989,0,1,510000,510100,,吹梦到西藏典故特别多，不建议古文不精的孩纸深度挖掘翻译,3442075127,6,2020-09-01 22:14:28
辞世love,3374782842,16,2,430000,431200,我爱你,不知道,3442049196,0,2020-09-01 22:07:23
辞世love,3374782842,16,2,430000,431200,我爱你,欠怼哦,3442044202,3,2020-09-01 22:05:54
白夜留行,1442635321,21,0,130000,130100,你在我的记忆中如黄金般闪耀。,唯有这一首听不腻,3441949499,0,2020-09-01 20:52:22
菠萝桥-_,1397379401,21,2,0,100,俱怀逸兴壮思飞 欲上青天揽明月,嗯吶[大笑],3441546500,0,2020-09-01 09:04:53
夏夜的安宁,1377329090,20,0,410000,410700,城南花已开，花落人不在,艹，有画面了,3441425469,0,2020-09-01 01:07:45
庭昭蕴,1300391456,23,2,430000,430100,挚爱张国荣,古风歌曲越来越多了，我还是最喜欢他们最初的样子,3441368146,4,2020-08-31 23:13:13
慕瑞秋,503254790,33,2,0,100,鱼跃此时海，花开彼岸天,这是银临歌曲的评论区，当然只有银临。喜欢云呆你去云呆转发的评论下面说,3441307413,3,2020-08-31 23:02:50
幽谷直树,1483251731,18,1,0,100,,好听好听好听 收藏的太晚 另外楼下纯nt 想打广告直接说嘛 整这啥意思,3441367869,1,2020-08-31 22:45:56
总是老歌最好听,466849449,29,1,0,100,啥歌都听，好听的都喜欢！,吹梦到西洲听几遍了也只会某音上火的那段，吹灭小山河听几遍就差不多会唱了，这就是差距，就像银临这首，听几遍就能记住了,3441314214,6,2020-08-31 22:43:06
总是老歌最好听,466849449,29,1,0,100,啥歌都听，好听的都喜欢！,也见到过有人在某音上点名说吹梦到西洲词藻堆砌……[大哭],3441317141,1,2020-08-31 22:40:53
许玖璃,1781868086,17,2,410000,410700,一世安,我知道啊，我想说这个人没素质,3441238261,1,2020-08-31 21:39:02
小狗旺旺最棒,73908689,0,2,0,100,一切顺利,谢谢陌生人的加油，我进面了，希望面试顺利第一,3441223377,0,2020-08-31 21:32:03
离溦溦,1543310045,0,2,0,100,渊生荆棘，荆棘深渊。,小学的时候喜欢看，但是家里不让，不知道最后的最后唐晓翼怎么样了,3441217418,0,2020-08-31 21:28:36
用户361430905,361430905,0,0,120000,120101,,不是,3441151410,0,2020-08-31 20:47:45
RIIIIIxxx,437710316,0,2,0,100,,太好听了,3441051007,3,2020-08-31 18:03:44
孽缘170417,469148818,0,1,210000,211300,,你这太大胆了，[多多捂脸],3440893771,0,2020-08-31 17:08:37
氵属性不明的小鱼干,1633484847,0,2,210000,210500,你的名字  是世界上最短的咒语,橙光入门曲,3440942140,1,2020-08-31 16:30:10
ArthurandWing,3349105621,15,2,440000,440300,嘻嘻,读过查理九世吗,3440842601,0,2020-08-31 15:29:35
sunshine_l2JE,2124511148,0,2,530000,530500,,佛  。歌大全。😝😡😝😜,3440852868,0,2020-08-31 14:08:48
离溦溦,1543310045,0,2,0,100,渊生荆棘，荆棘深渊。,嗯？,3440790420,0,2020-08-31 13:58:42
ArthurandWing,3349105621,15,2,440000,440300,嘻嘻,希望唐晓翼能再度出现,3440770247,0,2020-08-31 13:15:52
ArthurandWing,3349105621,15,2,440000,440300,嘻嘻,纪念唐晓翼纪念唐殿,3440714791,2,2020-08-31 13:12:33
ArthurandWing,3349105621,15,2,440000,440300,嘻嘻,赐绚烂一抹，繁华如锦，千万年永不凋谢你阖上眼晨曦迎来明天我拢起袖转身不忘不念萍水相逢，却成为一生诺言水光潋滟视线模糊的瞬间相知相遇不如那一次相聚逢最后一刻，凋零颜色，带着笑唱诵悲欢唐风陪伴着羽翼飞翔逍逝又何妨一羽之抄,3440774171,3,2020-08-31 13:11:59
ArthurandWing,3349105621,15,2,440000,440300,嘻嘻,聚散离合晕出一段时光终是化为飞沙究竟那张信纸能否寄到有过我们约定的那个地方过了曾经的年少轻狂相逢不过梦一场遇人微凉，星光微凉感触无常，残翼满裳谢去不忘，袅袅檀香命运沧桑，只剩虚妄运筹帷幄终是输了棋局一盘垂眸那名讳只能在心中默念怜你一世羁绊落入万,3440718660,1,2020-08-31 13:08:09
ArthurandWing,3349105621,15,2,440000,440300,嘻嘻,活在我的心上在那天涯告别一刹唐装黯朗，人世炎凉粉黛无华，泪染轻纱心头怅惘，无牵无挂中间失去了太多曾经的执念无人能再回首唤我一遍论这世间生死离别伤人无限能否归来这一刻，梦境曲折，再度与你并肩相随否认自己也曾遍体鳞伤重头来过也懂得希望渺茫,3440777091,1,2020-08-31 13:02:55
ArthurandWing,3349105621,15,2,440000,440300,嘻嘻,唐风陪伴着羽翼飞翔，晓雾就要消逝了那又何妨翼翎铺满了辽阔天际你像一缕阳光将回忆编织成一片云霞永远缭绕在心头的那首曲调远方遥遥传来笛声悠扬,3440719622,1,2020-08-31 12:58:35
thisiselio,558155338,0,0,0,100,人无再少年,六年级好喜欢这首歌来着,3440515634,0,2020-08-31 08:11:08
幽谷直树,1483251731,18,1,0,100,,真好听,3440537388,1,2020-08-31 08:05:17
紅荳醬,444946038,27,1,440000,440300,若是天下负了你，那我覆了天下又如何。 。，,只缘感君一回顾，使我思君朝与暮。,3440431559,1,2020-08-31 01:42:17
都给我去听三无和憨色的好汉歌,1479803414,18,2,440000,440100,一以贯之的努力，不得懈怠的人生。,Ky,3440504847,1,2020-08-31 01:42:05
风吉士,1455483337,19,1,0,100,想要吃好吃的,以前初中的时候，就经常和班里的几个同学拿着印着歌词的纸在教室里唱这首歌，我们还专门分几段词出来单唱和合唱。现在我们都分开了，歌也没再继续唱下去。,3440312531,1,2020-08-30 23:38:10
眼中永远有星辰大海,1605548135,21,2,310000,310101,,同道中人，无须多言[憨笑],3440375889,1,2020-08-30 23:32:13
爱蹦哒的宁静致远,1541805765,0,1,340000,340300,,[大哭][大哭][大哭][大哭]姐，你是不是当我憨,3440231507,0,2020-08-30 22:35:13
熠熠生菲-YIF,1912343336,0,2,330000,330100,,是啊，我本来想重新养一只猫的，但是觉得不管怎么挑都找不到这么好的猫了,3439999634,1,2020-08-30 19:26:41
白映光,509368794,29,1,310000,310101,甜包容苦，爱拥抱恨,鱼美人[多多大笑],3439910939,0,2020-08-30 16:23:27
许玖璃,1781868086,17,2,410000,410700,一世安,原唱是她吗…,3439824131,1,2020-08-30 15:04:01
曖汜,3826168291,23,2,360000,361000,一个默默的二次元coser，加油加油,好像是你是光，你是梦，我也不太清楚，声音太小了,3439593700,0,2020-08-30 12:12:10
潯饭,482351530,27,0,510000,510100,(⑉°з°)-♡,最爱的一首歌，这首歌让我知道了双笙，谢谢,3439443575,2,2020-08-30 09:07:43
keen082,1837044893,16,2,370000,371100,平安喜乐,1:24的时候，有种约定的梦幻岛的感觉,3439414719,1,2020-08-30 08:43:54
nijika激推,1744244310,0,2,0,100,一生奔赴一场大无畏梦境,还是很喜欢这首歌呢～,3439294099,2,2020-08-30 00:23:56
戲琥,1857188911,16,2,330000,330300,独关寒寒～,嗯，想起了数学老师……,3439243125,2,2020-08-29 23:49:09
果挞酸奶,3228121465,5,2,110000,110101,,扶桑画师浅溪，居泰安，喜绘鲤。院前一方荷塘锦鲤游曳，溪常与嬉戏。 其时正武德之乱，街邻皆逃亡，独溪不舍锦鲤，未去。是夜，院室倏火。有人入火护溪，言其本鲤中妖，欲取溪命，却生情愫，遂不忍为之。翌日天明，火势渐歇，人已不见。溪始觉如梦，奔塘边，但见池水干涸，莲叶皆枯，塘中鲤不知所踪。,3439179462,3,2020-08-29 23:25:47
果挞酸奶,3228121465,5,2,110000,110101,,从前有一位痴迷于画鲤鱼的画师。天天画鱼，喂鱼，与鲤鱼有了深厚的感情。某一天他家里发了大火。画师由于没法将鲤鱼带走而迟迟不肯脱离火海。在火将烧身之时，他看见了一个人，护送他安全离开。第二天画师醒来，看见池塘里全都干枯，鲤鱼也不见了，突然领悟到原来那当天救他之人便是鲤鱼幻化而成。,3439196409,2,2020-08-29 23:25:16
kisamon,1822658947,0,1,440000,440100,,这首歌的背后故事是耽美吗？,3439139860,2,2020-08-29 22:12:59
x蚍蜉渡海l,1344319833,26,2,130000,130900,,行，话糙理不糙,3438966502,0,2020-08-29 20:53:01
x蚍蜉渡海l,1344319833,26,2,130000,130900,,朋友 你百合了[奸笑][奸笑][开心],3438995231,0,2020-08-29 20:51:59
离离a__,3869798296,0,2,0,100,门没锁,晨露滴翠，岚雾深幻，流风和云绵，一壶春水煮茶。岁月单薄，苍苔探窗，添一笔草色连坡，阡陌依依。暮烟拂峦，踏雨潇潇归樵。剪一朝花间盛事，春迹栖枕。,3438786759,4,2020-08-29 18:31:57
沉浸在小世界,3442049342,22,2,440000,440400,风没有留下翅膀的痕迹，可我已飞过,有人说古风歌后有日本歌的影子，和人翻历史。那我只能说再去看看唐朝的日本借鉴中国史吧，同样的事放在现代就得背上骂名，大可不必[大笑],3438720064,5,2020-08-29 16:27:24
长逝啊,3220473614,0,2,130000,130600,,木了木了,3438564796,0,2020-08-29 15:04:22
a南城a,246472123,25,2,340000,340100,芦苇一支,人的心灵真是越来越脆弱了... 一丁丁点负面的评价都听不得... 人就是株有思想的芦苇也不能一点点风都吹不得吧... 更何况这还只是个已经尽力求生的客观评价呢...,3438272996,3,2020-08-29 08:27:06
auraodds_,538898063,0,1,0,100,I can't live without music！,忘了几时接触的 只是有个印象 已经过去好久了 那份情感逐渐浓烈...,3438105777,2,2020-08-29 02:57:13
睡不醒i安眠,412340940,0,0,0,100,,鲤鱼会做其实很好吃,3438110187,0,2020-08-29 01:10:20
愿得一人心_F28F,2112638266,23,1,530000,532900,天下风云出我辈，一入江湖岁月催。皇途霸业谈笑中，不胜人生一场醉。,哦哦……,3437995269,2,2020-08-28 23:34:00
小雪别买了,1516535164,23,2,450000,450300,没关系那就让小羊陪着我吧,哈哈哈我乱说的,3437956612,0,2020-08-28 23:30:26
小雪别买了,1516535164,23,2,450000,450300,没关系那就让小羊陪着我吧,因为那个女孩子跳了这个舞让他心动，我恰好跳舞像她,3437977365,0,2020-08-28 23:30:03
小沂-77,388323165,1,2,420000,421100,,哈哈哈,3437934172,0,2020-08-28 22:41:59
小沂-77,388323165,1,2,420000,421100,,超级喜欢,3437928230,2,2020-08-28 22:41:52
桐树之栖,1468744478,21,0,330000,330600,,不知道为什么，两年之后再听这首歌，哭的停不下来，喘不过气。才知道时间是真的过去了，我再也回不去了。,3437965816,4,2020-08-28 22:41:25
_-冬眠,381344148,20,1,1000000,1001300,,也没让你说啊，您说抄了就抄了,3437948903,1,2020-08-28 22:33:44
开心的我和月亮以及-,1375559834,0,2,0,100,,初中经常听的古风歌啊啊,3437910265,4,2020-08-28 22:33:23
森霭茶,1368472024,16,2,310000,310101,snow white永远滴神,倒也不是因为他们喜欢翻唱，我自己本身也很喜欢一些翻唱的作品，也不是说他们做错了什么，单纯有点气歌曲传去了，这么优秀的原唱却不为人知，反倒被认成别人的了，其实我之前说的也挺主观的,3437940837,1,2020-08-28 22:23:18
落下海面,1738200887,0,2,0,100,last,您可以自己去听听 多的不想说.,3437879043,0,2020-08-28 21:58:55
_-冬眠,381344148,20,1,1000000,1001300,,嗯，您说抄了就抄了,3437823230,1,2020-08-28 21:26:57
Mercurywhale,1913702307,19,1,350000,350600,波光潋滟，镜花水月,安屠生,3437710146,0,2020-08-28 19:56:34
西耳示东风,1607358783,25,2,440000,440100,,是才[奸笑],3437688141,0,2020-08-28 19:38:46
孟门糖氏_,2122446795,19,2,220000,220100,,说一句你们可能不信，其实鲤鱼被我炖了,3437567558,0,2020-08-28 18:32:19
surnery,1637341664,0,2,370000,370300,要好好听,就是说啊无论多少遍二胡一进来我永远会瞬间热泪盈眶,3437502334,3,2020-08-28 17:00:56
惊鸿挼霜,1963373594,0,1,0,100,,我觉得可能就是没太注意过原唱啊。就像很多人一开始都以为但愿人长久是王菲的，其实原唱是邓丽君。再说，喜欢翻唱还是原唱完全个人自由，楼主因为人家喜欢翻唱而生气去质问人家，本身就有些莫名其妙啊，你想想那个场景，就像一个男生说他喜欢a，b上前质问男生为什么不喜欢自己一样，听着感觉很怪诶,3437483511,3,2020-08-28 16:57:40
南橙的光,1554838713,20,2,430000,430600,,抄袭,3437474386,4,2020-08-28 16:43:24
卿千傲CAC,2142722122,19,2,610000,610800,“提及少年一词，应与平庸相斥”,听你们说大佬，点进去看了一下主页，然后整个人就：？？？？？？！！？？？？？？我是谁我在哪我在干什么,3436747463,11,2020-08-28 00:01:44
卿千傲CAC,2142722122,19,2,610000,610800,“提及少年一词，应与平庸相斥”,哈哈哈哈哈哈哈哈哈哈哈,3436736561,0,2020-08-27 23:56:55
一朵伊小莲,1573534563,0,2,320000,320800,踟蹰而行，不问归处,相遇，相识，相交，相依，相离，相逢，相守。,3436617733,4,2020-08-27 22:50:16
侧坐莓台,1729982646,0,2,420000,420100,,希望你们都平平安安的鸭～,3436563173,0,2020-08-27 21:35:00
25時全肯定bot,510787085,0,2,320000,320600,本质25团推，但这跟白石杏是我老婆又有什么关系呢。,正常人谁不想好好说话，她先开始的就不能怪我了……这样。,3436330006,3,2020-08-27 18:01:45
25時全肯定bot,510787085,0,2,320000,320600,本质25团推，但这跟白石杏是我老婆又有什么关系呢。,我本来没有怼啊，是她先阴阳怪气的。而且“能不能不要只记得银临”有点开地图炮的意思了。,3436287453,4,2020-08-27 18:01:25
25時全肯定bot,510787085,0,2,320000,320600,本质25团推，但这跟白石杏是我老婆又有什么关系呢。,管 好 你 自 己，银临粉丝不一定是云泣粉丝，甚至圈外人可能都不认识，所以刷自己认识的一 点 问 题 都 没 有，真不知道你地图炮是想找什么存在感。缺人对线？？,3436241783,5,2020-08-27 18:00:18
25時全肯定bot,510787085,0,2,320000,320600,本质25团推，但这跟白石杏是我老婆又有什么关系呢。,我从来没说不是共同合作啊……？？,3436335893,0,2020-08-27 17:56:33
25時全肯定bot,510787085,0,2,320000,320600,本质25团推，但这跟白石杏是我老婆又有什么关系呢。,？？你回复错人了吧……,3436253660,0,2020-08-27 17:56:17
25時全肯定bot,510787085,0,2,320000,320600,本质25团推，但这跟白石杏是我老婆又有什么关系呢。,再：评论间隔时间太长，想对线就私信，无意对线建议拉黑。,3436240752,3,2020-08-27 17:52:04
25時全肯定bot,510787085,0,2,320000,320600,本质25团推，但这跟白石杏是我老婆又有什么关系呢。,我要是去你喜欢的作者评论区评论这一条你自己高不高兴自己没数？有数就别膈应人了。,3436237775,4,2020-08-27 17:46:56
25時全肯定bot,510787085,0,2,320000,320600,本质25团推，但这跟白石杏是我老婆又有什么关系呢。,怎么会有人对好好说话的人yygq啊，不会吧不会吧。那就不要怪被骂了。活该,3436335805,3,2020-08-27 17:46:00
25時全肯定bot,510787085,0,2,320000,320600,本质25团推，但这跟白石杏是我老婆又有什么关系呢。,你要是说这首歌本身怎么怎么样都不会被这么回复，纯属自己作的哪里来的脸让别人管好自己。说你语文不及格一点没冤枉你。,3436241641,3,2020-08-27 17:43:35
25時全肯定bot,510787085,0,2,320000,320600,本质25团推，但这跟白石杏是我老婆又有什么关系呢。,看完了评论。宁如果真不想杠八月七号就可以删除评论，留着不就是隔应人的？自己居然还有脸说管好你自己。这话送给你，粉丝爱刷谁刷谁管你什么b事。自己不乐意看就别看评论或者自己刷云泣去。,3436241622,6,2020-08-27 17:41:30
平眉一言空明镜,1513498962,0,0,440000,440300,,词很美啊,3436325850,2,2020-08-27 17:40:23
25時全肯定bot,510787085,0,2,320000,320600,本质25团推，但这跟白石杏是我老婆又有什么关系呢。,我刚开始好好说话你看不懂还是你觉得我是软柿子比较好捏怎么的？,3436269300,3,2020-08-27 17:29:28
25時全肯定bot,510787085,0,2,320000,320600,本质25团推，但这跟白石杏是我老婆又有什么关系呢。,几月过去了不想被骂不会自己删评？说的是人话自己不知道吗谁对谁错自己不知道吗？还是希望别人给自己喜欢的歌手施舍一句喜欢？,3436207767,5,2020-08-27 17:28:52
25時全肯定bot,510787085,0,2,320000,320600,本质25团推，但这跟白石杏是我老婆又有什么关系呢。,那你自己吐槽的是个什么东西自己没眼睛看？,3436212731,4,2020-08-27 17:20:09
25時全肯定bot,510787085,0,2,320000,320600,本质25团推，但这跟白石杏是我老婆又有什么关系呢。,同理，吐槽歌和歌手也可以,3436301865,3,2020-08-27 17:19:55
25時全肯定bot,510787085,0,2,320000,320600,本质25团推，但这跟白石杏是我老婆又有什么关系呢。,啊你这么理解我也没办法。吹捧至少吹的是歌手和歌,3436264217,4,2020-08-27 17:19:44
牛大单,3347358401,21,0,0,100,,鲤鱼……熟了吗？[呆],3436185708,0,2020-08-27 16:59:49
十七诗琪,629995967,0,2,420000,420200,,真的是回忆呀，还是初中的时候听了这首歌，还记得那时候偷偷的带手机，就为了抄歌词😹😹,3436107633,9,2020-08-27 15:27:01
25時全肯定bot,510787085,0,2,320000,320600,本质25团推，但这跟白石杏是我老婆又有什么关系呢。,“这么多杠精”很好理解，比如我就是刚发完一条吹银临的评论就看到你这条。,3436131278,4,2020-08-27 15:13:13
25時全肯定bot,510787085,0,2,320000,320600,本质25团推，但这跟白石杏是我老婆又有什么关系呢。,那些单纯吹吹自己喜欢的作者的莫名其妙被你这么一个地图炮，正常人都不舒服，那就不要怪别人了。,3436089642,3,2020-08-27 15:07:01
25時全肯定bot,510787085,0,2,320000,320600,本质25团推，但这跟白石杏是我老婆又有什么关系呢。,吐槽可以自己私下里跟朋友一起或者别的什么，没必要发出来，毕竟发出来就会被人看到，那也就不在个人吐槽的范畴了。,3436155011,3,2020-08-27 15:05:13
林柒湉,1922234056,17,2,0,100,希望快乐,第一首听的歌，第一个喜欢的歌手(银临)，年幼无知的我第一次从一首歌里听出了故事，陪伴我从小学走向中考，我想，请以后的以后都陪着我吧,3435863788,3,2020-08-27 11:41:40
沉浸在小世界,3442049342,22,2,440000,440400,风没有留下翅膀的痕迹，可我已飞过,令我心动的歌词以及唱法都是云泣，好喜欢她[色],3435824969,3,2020-08-27 09:11:53
香草味布丁粉,3317183989,17,2,0,100,智者不入爱河，寡王一路硕博，冤种重蹈覆辙。,是嘛？好吧谢谢(￣▽￣),3435802129,0,2020-08-27 09:00:25
枪版朏朏,599729866,19,1,450000,451000,,灰：mmp,3435686339,2,2020-08-27 03:10:14
愿得一人心_F28F,2112638266,23,1,530000,532900,天下风云出我辈，一入江湖岁月催。皇途霸业谈笑中，不胜人生一场醉。,为什么,3435659892,2,2020-08-27 00:55:25
画船听雨眠FY,501466085,0,0,1000000,1000100,我们生而破碎，用活着来修修补补,过了这么久再回来听这首歌，前奏响起的那一刻，还是很惊艳,3435491011,2,2020-08-26 22:55:25
和泉-正宗,391430519,19,1,150000,150400,,红昭愿为什么不配？这首歌最初的音源是流芒菌【估计现在都没什么人认识了】而且她的版本和现在的还有些区别，不要因为这个歌火了就无怨无故diss这个歌,3435404179,5,2020-08-26 22:08:50
帐号已注销,3263123517,无,无,无,无,无,姐姐[流感][流感][流感]（我的这个评论在老后头了吧[鬼脸][大哭][大哭]）一起等他回来[爱心],3435316918,1,2020-08-26 20:44:08
舒浔,543126156,19,2,320000,320500,师哥，玫瑰到了花期我很想你,这歌都出了6，7年了,3435250214,1,2020-08-26 20:15:31
言柒_en,3238725858,0,2,370000,370900,喜欢海，喜欢花，喜欢日出和日落，浪漫的年纪别活的太无趣这里是言柒，性格温柔内敛，甜美少女音，喜欢听音乐和聊天📋，欢迎来找我丸吖～❤粉团7级可+v，也可相约王者峡谷～直播时间4:30pm之后,真的找到唐粉了[多多大笑][多多大笑],3435138566,2,2020-08-26 19:12:34
