_庐山烟雨浙江潮,511812033,0,0,0,100,何谓枯荣又何谓云泥,迟意老师的词我太爱了,5958527943,2,2023-08-11 06:43:06
共華髮,267716716,0,1,0,100,ぃ悲傷、述說微笑,许是因为成长的时光跑的太快，而它每次加速都是以离别为代价,5958457154,1,2023-08-11 00:59:31
Chord-Y,2062265429,0,2,440000,441200,,是的，这就是真实的竹马。我也差不多。,5958169110,9,2023-08-10 20:01:13
Tequila_whiskey,1605961470,0,1,0,100,这家伙真的很懒,早晨被师傅叫醒催促他背诗经 不明所以 年少怎知川流不息 岁月走走停停 没写出游记最后的最后 他挽着爱人 醉倒在高山 望着云海 月亮明亮 一只巨大的鲲灵浮现 它周身似乎满是星光 歌谣也接近尾声醒来的他 惟觉时之枕席 眼角唯有泪两行耳机边传来“我有满身欢喜”“只除过世界太挤”“头顶月，眼中,5957360781,1,2023-08-09 10:22:12
Tequila_whiskey,1605961470,0,1,0,100,这家伙真的很懒,夜晚 那个孩子深深的睡眠那是他浅浅的梦中 阵阵响起的歌谣这个梦 奇幻又美丽 颜色像被打翻的颜料盒一样散落在天空 宛若传说的仙境世界 他的梦 似乎和歌谣一一对应 背诵的诗经 长亭 老街 书中的颜如玉此刻他是梦中的主角 月亮舟楫 瑶光天星 他在梦中游山玩水 像为文人风骨的诗人游子 一切都是水墨风,5957358311,1,2023-08-09 10:21:35
第一页-,1351810464,19,2,440000,440800,只能靠R&B维持下生活这样子,好幸福啊,5957038811,0,2023-08-08 19:40:53
芝麻_zm,246739141,0,2,440000,440500,,加油加油！！！[可爱],5956652594,2,2023-08-08 00:46:43
给朕找个名字来,2004214640,0,1,230000,230700,,看了歌词才知道是被点名，我一直以为是背典明,5956554320,4,2023-08-07 22:14:34
857岁酒味老仙女,600791902,0,2,0,100,干净.,一样,5956425390,0,2023-08-07 19:07:20
857岁酒味老仙女,600791902,0,2,0,100,干净.,这是发小哈哈哈，无关爱情,5956407505,1,2023-08-07 19:05:31
a_mau,47732898,30,1,440000,440100,大杂烩,好好听,5955766810,1,2023-08-06 22:47:44
白芷TY,3270938680,0,0,1000000,1002400,梅子黄时雨,师兄…,5955530820,0,2023-08-06 14:54:05
十二阑干凭,8747484161,0,2,0,100,,没问题。魏晋尚风雅，多有游山玩水之客，所以说山中魏晋,5955469897,0,2023-08-06 12:27:42
十二阑干凭,8747484161,0,2,0,100,,祝幸福啊,5955466897,0,2023-08-06 12:17:41
山洞拉面哥,8660441569,0,0,0,100,,加油啊,5955387096,1,2023-08-06 08:37:01
太空造梦者,1346805193,22,2,0,100,跳进金黄色的池塘,儿时无竹马，,5954260951,2,2023-08-04 07:57:03
茶苡_shFN,1999868078,0,2,520000,520100,,好，我该逃离刀子了。,5953977522,0,2023-08-03 20:11:12
Romantiqu_e,5024066506,15,2,310000,310101,,从前两小无猜，可现在你在哪里。我大概只不过是你最无足轻重的忘却。,5953720624,2,2023-08-03 14:39:15
给予一场空,3385207004,0,2,350000,350100,小姐姐谈恋爱吗？我女的,5啊0,5953398781,0,2023-08-02 23:28:47
卡尔不吃香菜,390682092,23,2,450000,450100,一个平平无奇的女大,有没有可能是 女孩都被····,5953171418,1,2023-08-02 16:12:33
今晚要变成星星,1362393725,0,0,0,100,日复一日重复我的NPC打卡,₍˄·͈༝·͈˄*₎◞ ̑̑,5953020389,1,2023-08-02 10:26:45
某祎睡不醒,611970359,0,0,430000,430100,“我想年青死了是长春，我们对了青草，永远是一个青年。”,我猜应该是《东周列国演义》《东周列国演义》原名《东周列国志》是一部讲述春秋战国历史的小说。起于西周末的周幽王被杀、周平王执政东迁，秦始皇统一天下，略述了五百多年的历史，这一时期的人和事，在历史上最突出，最典型，它几乎是后世是非成败的理论源头，更是后人行事为人的标准和榜样。,5952911190,9,2023-08-02 01:53:52
T2ya,497801407,34,1,440000,442000,,东周演义什么意思，求大神科普,5952788507,1,2023-08-01 22:35:41
乂肀夂,1824914947,18,2,330000,330300,……想死,怀念……,5952748135,1,2023-08-01 21:28:39
我超爱学习鬼火大大,3305660764,15,1,510000,511500,爱挂机，爱鬼火，最爱用R键,听着好舒服,5951598751,1,2023-07-30 22:34:19
我超爱学习鬼火大大,3305660764,15,1,510000,511500,爱挂机，爱鬼火，最爱用R键,听着好舒服,5951597037,1,2023-07-30 22:34:14
三角铁天才,1618017950,0,2,530000,530800,万物明朗，事皆有变.,笑问，曾经的竹马如今散落江湖何方呢,5951393831,2,2023-07-30 15:49:49
暨如一,328223213,22,2,0,100,韩文清的女朋友,美好可爱到想流泪，，，🥺😢🤧,5951306326,6,2023-07-30 12:44:32
寄春君,101099235,0,2,710000,712400,终须会时辰到 别怕,谢谢你的祝福～,5950692362,1,2023-07-29 11:21:37
寄春君,101099235,0,2,710000,712400,终须会时辰到 别怕,是我们一开始一起玩剑三 完了剑三之后又回归现实结婚的意思啦,5950692348,2,2023-07-29 11:21:26
海蓝色的炑炑,8554153822,0,0,0,100,在自己的身体里放入自己的灵魂，做到人心合一,我也想活的这么潇洒自在,5949928338,1,2023-07-28 08:03:19
孙嘉琪__,1800102652,17,1,210000,210700,风吹雨成花,迟意的词可以说古风天花板了，没有之一,5949786520,2,2023-07-28 00:12:01
我的眼眶为什么湿润了,1687489713,33,2,320000,320800,我也想画萌妹子啊kuso~！,词写的好美,5949489592,4,2023-07-27 15:30:14
好困好想睡懒觉,1413407167,23,2,440000,440100,怨只怨人在风中 聚散都不由我,是我羡慕的那种青梅竹马！,5949474958,1,2023-07-27 14:47:47
海蓝色的炑炑,8554153822,0,0,0,100,在自己的身体里放入自己的灵魂，做到人心合一,歌声甜甜的，清清爽爽，听着心情舒畅,5948216400,2,2023-07-25 16:37:15
Justin_____Bieber,416214897,18,1,440000,445100,.,同上,5948143341,1,2023-07-25 14:08:08
Justin_____Bieber,416214897,18,1,440000,445100,.,恭喜（来自2024届考生）,5948130907,2,2023-07-25 13:35:12
请上天赐我一个男友,1940292826,20,2,440000,440100,快乐至上,真实的竹马就是，我和他从小住在一个院子里长大，幼儿园一个班，天天玩在一起，我老是咬他，然后我爸妈就上门赔礼道歉，小学在一个小学，已经开始没联系了，初中依然在一个初中，没见过彼此，我在重点班，他在最次的那个班，高中不在一个学校，有时候遇到对方父母会打招呼，但是遇到他形同陌路,5947745067,52,2023-07-24 21:06:03
砚欺白,327880943,0,2,1000000,1010000,滚烫人间无声雪,这破游戏在我A了一段时间之后注销了我的账号....生气！已经有好多好多卡了！,5947629555,1,2023-07-24 17:15:43
浓于热情,262179631,0,1,440000,440900,,嫉妒使人东邪西毒,5947338677,1,2023-07-24 02:23:36
贤贤吃饱了吗,425623520,18,2,510000,510100,如果十年后你还是爱我的话，那就请再次向我走来吧,想起叶问舟[多多大哭],5945918467,5,2023-07-21 18:43:05
ygpzys111,6477893764,0,0,420000,420100,,吹梦到西洲确实是华丽辞藻堆砌，流光记挺好的古风歌,5945882557,1,2023-07-21 17:26:35
ygpzys111,6477893764,0,0,420000,420100,,[大哭],5945884271,0,2023-07-21 17:25:44
__廿九_,1346972457,0,2,320000,320500,“我保护你好不好”,真的好想遇到和我一样喜欢诗词歌赋的十八岁少年啊！！！,5943989826,1,2023-07-18 23:14:43
看鱼不吃鱼鱼,5197447359,17,2,410000,410300,6,真正喜欢你的人，才不会在意你这些,5943537295,1,2023-07-18 10:27:39
Xenia_xy,3718965802,0,0,440000,440100,,单方面宣布这就是最适合我们宜往情慎三哥眉眉的曲子了,5943251163,4,2023-07-17 21:44:55
韩非子小良子,548878012,0,2,0,100,bitch,哈哈哈,5943188528,0,2023-07-17 19:48:19
岛屿山川-,469600071,21,2,350000,350100,热爱可抵岁月漫长.,我的竹马是我第一个讨厌并且反感的男生…随意评价女生长相，不懂得尊重女生，而且引导校园暴力，普通却自信，表里不一[汗],5943166803,0,2023-07-17 18:47:01
imissxiu,1667229882,0,0,0,100,likeee star.,我爱叶问舟,5942816477,2,2023-07-17 02:53:51
楚清眉,1802873443,0,0,0,100,,愿同尘与灰,5942494862,2,2023-07-16 20:11:10
蓝豆真逗,8269484508,0,0,0,100,,没在一起 是虐的,5942472892,0,2023-07-16 19:20:31
黛丝莉女装_Us7q,3278916702,0,1,410000,410500,,我还在想和这个姓好高级 发现是和(与)先生,5942379394,0,2023-07-16 16:39:38
无尽延,1841951645,0,2,360000,360300,2025高考加油。,姐姐要一直幸福下去啊,5941922859,0,2023-07-15 21:32:23
爱吃布丁的兔子,645147102,0,2,330000,330100,,三年过去啦，个人也成熟了很多，努力过很多方向。我去考过研究生，当年9月目标院校取消了该专业对跨考生的许可。我只能临时换院校换专业，最后果然没考上。走出考场那天，我也错过了省会的提前批教师编考试，很遗憾，但也很坦然。我努力过了。考研结束第三天，我没有跟伙伴一起去蹦迪嗨，开始自习。,5941466797,1,2023-07-15 00:24:05
裴远徵,1607667663,18,1,0,100,,放暑假啦啦啦啦啦啦啦啦,5940783053,2,2023-07-14 03:20:06
行你牛必,1636488175,26,1,150000,150400,世界微尘里 吾宁爱与憎,银临我老婆,5940411774,1,2023-07-13 17:31:10
肆岑2101,3870419748,0,1,370000,370400,,岁月走走停停,5939997260,1,2023-07-12 23:13:35
将爱给餘你,5048667522,17,1,410000,410700,放弃我,99,5939999110,0,2023-07-12 23:12:41
yljyydns,3382360535,0,0,0,100,,虽然在棠梨煎雪的评论区里面说银临更适合唱流光记这种小甜甜的风花雪月，但是发现似乎还不够甜[大哭]唔似乎很可爱的流光记也不需要太甜啦[大笑],5939924629,7,2023-07-12 21:08:35
来杯冰镇橙汁,577263831,22,1,410000,411500,"那里会有花开四季的屋顶",就这么说，这歌词要是我写的，我这辈子值了，太牛了,5939271460,3,2023-07-11 17:28:43
行山河,1936265131,18,2,130000,130500,,好好听,5939266103,1,2023-07-11 17:09:37
雪儿ycc,437326480,27,2,530000,530100,,谢谢[拜],5938261961,1,2023-07-09 22:56:27
小木偶不要说谎,98867451,39,1,440000,440600,整天无所事事，浪费时间地过日子！,春和秋那句是那首歌的，很熟悉，想不起,5938236898,2,2023-07-09 22:13:55
-囹圄-,3695264658,0,1,0,100,让我看看你对我好感度多少,一切都會好的,5938217527,2,2023-07-09 21:42:42
雪儿ycc,437326480,27,2,530000,530100,,初听这首歌是2018年，当时读大四，躺在宿舍床上一直单曲循环，后来冲动的约我室友和我去拍了人生中的第一套古风写真。而今是2023年，裸辞回家考编的第三个年头，昨天刚刚考完特岗。突然觉得这三年，真的一事无成。工作工作不行，恋爱恋爱谈不好。好想回到大四时的那个早晨,5937809095,7,2023-07-09 01:09:52
_-齐霁_-,1719869916,17,2,210000,210100,假如思念有声音 那会是一场海啸吗,逛一圈東周演義山中魏晉唐宋元明清🎶,5937722271,1,2023-07-08 22:49:04
麻吕吕i,311281680,24,1,330000,330700,这个狠人贼懒，什么都没留下。,开口脆 呜~,5937598767,1,2023-07-08 18:42:02
怎么办呀__,1733893322,0,2,0,100,,听到这首歌，就想到师兄，叶问舟，天底下最最好的师兄生日快乐！,5937563178,2,2023-07-08 17:17:40
梵高本梵,8615493199,18,1,410000,410400,,体育：嫉妒使[多多捂脸]我拳脚相加,5936502774,0,2023-07-06 17:48:49
梵高本梵,8615493199,18,1,410000,410400,,转一圈就你最6,5936502204,0,2023-07-06 17:48:01
--瞳--,1553035964,18,2,0,100,长大，是不期而遇的温暖.,一起打游戏，然后一起退出剑三是个游戏哦,5936348024,0,2023-07-06 11:05:58
落叶霜染青梅天,1347925017,0,2,0,100,,真的好甜啊！羡慕了。但是想问一下姐姐从现实辗转到剑三，又从剑三辗转到现实是什么意思呀？,5936307411,0,2023-07-06 09:29:45
-Ceylan-,365192216,19,1,440000,440300,,听到这首歌就想到我刚来二中的时候,5935621583,2,2023-07-05 01:09:23
酸枣仁-,590540384,0,2,210000,210800,YOLO,头顶月，眼中你🌙,5935460034,3,2023-07-04 20:03:47
叫我文文吧,626231754,0,2,0,100,我真的爱你 句句不轻易,新樟路🌿❤️,5935424442,1,2023-07-04 18:34:51
不帅很丑啊,1604793422,2,1,360000,360700,寻鸟中学,[色],5935399285,0,2023-07-04 17:24:57
不帅很丑啊,1604793422,2,1,360000,360700,寻鸟中学,[发怒][发怒],5935398249,0,2023-07-04 17:23:43
不帅很丑啊,1604793422,2,1,360000,360700,寻鸟中学,翻评论[大哭][大哭][大哭][大哭],5935401736,0,2023-07-04 17:23:18
不帅很丑啊,1604793422,2,1,360000,360700,寻鸟中学,他肯定是遇到困难了[呆],5935396356,0,2023-07-04 17:17:09
不帅很丑啊,1604793422,2,1,360000,360700,寻鸟中学,[亲亲],5935395219,0,2023-07-04 17:10:56
不帅很丑啊,1604793422,2,1,360000,360700,寻鸟中学,[流泪],5935391446,0,2023-07-04 17:08:13
九五来咯,1313895552,21,2,500000,500101,I Love Me,虽然但是很好笑,5934912711,0,2023-07-03 18:10:27
星坠沉塘_falling,1923351442,19,2,0,100,🌟夏夜的星空由我们点亮🌟,时隔三年的回复，你真的好温柔啊[爱心],5934596153,1,2023-07-03 00:19:52
日落闻君归,3949162689,0,0,0,100,,但因为搬家的缘故，见面次数少了很多，后来他爷爷去世，两家往来就更少了，小时候又都没有联系方式，长大后见面也只是腼腆一笑想起这些来还是觉得很幸运，在小时候能有这么一个人相伴左右,5934542553,10,2023-07-02 22:57:37
日落闻君归,3949162689,0,0,0,100,,他会时常给我制造惊喜，拉着我的手带我去找各种有趣的事物，在放学后我们会嬉笑着一起走回家小时候我的性子很野，经常拉着他去捞鱼爬树，捉各种虫子，晚上的时候跑到街尾的小道上看萤火虫，或者坐在院中看满天的繁星,5934536730,10,2023-07-02 22:51:55
日落闻君归,3949162689,0,0,0,100,,我们的爷爷是战友，所以两家时有往来，只记得从记事起我们就常待在一块，我很黏他，天天跑去找他，为此大人们总调侃道我是他的小跟班我是在他读学前班一段时间后才插班进去的，老师问我，想要跟谁坐一起，不知道为什么，我第一眼就看到了坐在第一组后排的他，走到他的身旁跟老师说，我想要跟他坐同桌,5934532484,17,2023-07-02 22:45:08
一只小冰粥,606070452,0,2,350000,350100,喜欢喜欢喜欢大爷和小骗子。,“逛一圈东周演义山中魏晋唐宋元明清。”这句自从初二听到，不仅用在中考作文还用在高考作文[多多比耶]这首歌真的太好用了[多多比耶],5934011960,184,2023-07-01 23:21:14
雨曰_,541317264,0,2,350000,350500,普普通通小青年,一样，现在赶紧换了[流泪],5933728488,0,2023-07-01 12:17:05
花花不吃瓜_doki,1906130767,21,0,110000,110101,,多读书，吃点好的，咱也不知道你在说什么[大笑],5933342690,1,2023-06-30 17:46:01
千瑜千浔2021,4928108214,0,2,310000,310101,,其实历史长河的每一段都是由不同层面构成的，仿若多棱镜，端看你从哪个角度去观察。现在的历史学，哪一年发生了啥事儿，突兀而割裂、刻板而无趣，并且专注于争斗、战争、政治事件，所以非常理解你的感受。或许要真正了解历史还得去修仙，从总体上来把握[呲牙],5932316759,3,2023-06-28 13:38:29
kzcss,397210707,0,0,450000,451200,,后半段写的时候从书中知道了很多东西，对书里的东西有自己打幻想，但是因为没有经历过所以体会不到诗里的那种情绪。又是在同样的地方和季节收着燕子飞来时掉落的羽毛（代表了日复一日同样的生活）,5931809552,0,2023-06-27 18:11:55
kzcss,397210707,0,0,450000,451200,,写的就是青梅竹马，前5句你可以理解为在玩过家家。两个人翻书没找到颜如玉就是因为好奇这句话所以去翻书想找颜如玉。照着这想法后面就好理解了。,5931803175,0,2023-06-27 17:48:23
景天的降魔剑,431650300,24,1,500000,500101,瓜子一起吃，刀剑一起挡！,歌词太意境啦！[多多调皮][多多亲吻],5931458975,4,2023-06-27 03:52:37
长安里听长安歌,1382709779,0,2,0,100,少年自视岁月长,想想自己没有青梅竹马,5931347452,1,2023-06-26 23:27:09
阿黛莱茵,441894209,0,2,1000000,1001800,树枝想去撕裂天空却只戳了几个微小的窟窿它透出了天外的光亮人们把它叫做星星和月亮,童年的味道，青梅竹马值得留恋,5931317128,2,2023-06-26 22:34:24
我想吃小蛋糕,510822333,0,0,0,100,,恭喜你！,5930613378,3,2023-06-25 20:23:14
芝麻_zm,246739141,0,2,440000,440500,,出成绩了各位，是我意想不到的，可以照耀我整个夏天的成绩，上半年一直过得很难受，哭的次数更是数不清，直到出成绩前都不相信我能考好。也祝君努力，到达想要去的远方。无论结果如何，人生出路不止一条，一纸分数不能否定你的努力，不能决定你的未来，生命迷人之处不在于一步登天，在于积跬步至千里,5930554177,11,2023-06-25 17:58:45
Noooorah,1415186752,0,0,1000000,1006600,我也想睡个好觉,头顶月 眼中你,5930450411,11,2023-06-25 13:28:54
清清月上霁,4027698883,0,1,350000,350900,,可可爱爱的,5929902232,2,2023-06-24 13:21:44
依依东望故人归,1530919190,0,0,440000,440500,,喜欢这首歌，喜欢小银子声音里的调皮可爱，喜欢迟意歌词里的天真无邪，喜欢透过这首歌脑海中浮现起的童年光景。,5929636901,29,2023-06-23 23:30:28
清欢赠朝夕,3349554188,0,2,530000,532900,Poetic Fish,“相识至今，未曾别离，在此之后，我也不想与你分开。问舟情之所钟，一生一世，一心一意，唯你一人。”,5929614191,4,2023-06-23 22:57:36
周佳加,8530954779,23,2,0,100,“在所有的道别里，我最喜欢明天见。”
嗨，大家好，我是周佳加
十里春风不如你，我在等风也等你
终于和大家见面啦！
希望我的声音可以治愈每一个小耳朵👂🏻
Pick me Pick me ！！yeah yeah,旍旄剑拔鼓噪，优倡侏儒戏前，趋进齐惧归田。定公十年，夫子人生至巅。,5928791008,2,2023-06-22 14:47:10
gjfqmzzxrmxf,3336857975,0,0,0,100,,把折柳听了又听，总学不会别离。,5927846241,11,2023-06-20 23:54:28
呵呵220724,5077055582,0,2,210000,210200,我要去复旦,怎么样啦[大笑],5927793428,2,2023-06-20 22:28:23
蒸汽波人類,1498173972,0,2,110000,110101,水瓶 装汽油 哈哈哈哈哈哈哈哈,“头顶月 眼中你 ”可惜没人 哈哈哈哈哈,5927529698,1,2023-06-20 12:41:07
溶哲_Aris,1573437479,0,2,0,100,来自天狼星～,谁能想到？？？我的小竹马早已散落于天涯，但他二姨，阴差阳错的现在住在我家楼上[大哭],5927362927,3,2023-06-20 01:54:14
弈见倾星,1832023174,18,1,120000,120101,,也可能只是两个小朋友逛了圈老街,5926200564,0,2023-06-18 05:52:32
弈见倾星,1832023174,18,1,120000,120101,,现实是浪漫还是残酷的?谁能说? 还是看人吧，历史只是过去的现实而已,5926204787,2,2023-06-18 05:50:18
NGC2237-seulement,400197197,24,2,140000,140200,琥珀色黄昏像糖在很美的远方~,我也最喜欢这句！头顶月眼中你,5926045013,1,2023-06-17 22:39:59
仍有无言山河,3361414300,19,1,620000,620500,修道之人，远离红尘，幽居修行，爱憎一起，道心既退,古人说话并不是和古文一样，口语化才是日常,5925944875,0,2023-06-17 19:50:39
小宁可烦,1364053193,19,2,370000,371300,许鹤宁,“叶将军府的三小姐，喜欢过那个为她绣盖头的少年帝王。梦境中的黎苏苏，喜欢过为她补魂的沧九旻。”她顿了顿，声音很轻很柔：“一如现在的我，爱着忘记回家的你。”看到这一段正好放到这首歌高潮，哭死我了[流泪],5924380078,4,2023-06-14 23:55:24
徘槐_,3294242359,15,2,110000,110101,烟花易逝 人情常存,有点像爱让悬崖变平地 但只是有一点点像 （）,5923868946,1,2023-06-14 06:00:02
一弦一柱一枝一叶尽是华年,1323699139,22,2,120000,120101,快乐太过奢侈,这首歌是每当我emo的时候最先想到的歌，这种轻松愉快的歌好少啊，特别喜欢这首，想多听到这种感觉的歌,5923324931,1,2023-06-13 01:02:17
脆柚桃,7959523608,0,0,0,100,,一起,5922445209,0,2023-06-11 17:47:51
_森狸厘_,1550680991,22,2,330000,330100,,没有结局了哦,5922300980,0,2023-06-11 12:26:31
弃天之帝之天弃,420994072,29,0,500000,500101,一个人来，一个人去；一个人走，一个人停。,黑子想黑总能找到借口的,5920954634,0,2023-06-09 09:40:47
弃天之帝之天弃,420994072,29,0,500000,500101,一个人来，一个人去；一个人走，一个人停。,一直以为这首歌叫唐宋元明清[大哭][大哭][大哭][大哭],5920957941,2,2023-06-09 09:40:07
ZZTTEEOOSS,3912017287,20,1,510000,510600,,12/1小时。,5920868482,1,2023-06-09 01:41:00
莘乑,496043534,23,1,330000,331000,看着你幸福，也便是我的幸福,唯愿前程似锦，希冀更好的未来，祝愿高考的诸位,5920495985,3,2023-06-08 13:36:15
云匿Rachel-,1890070289,21,2,330000,330100,账号已注销,加油,5920074953,2,2023-06-07 18:45:27
忆逝__isVZ,1484268936,0,0,0,100,朝斯夕斯，念兹在兹，磨砺以须，及锋而试。,对啊，真的好有感觉啊,5919240036,2,2023-06-06 17:17:26
云村村民167127659291988,8193546531,0,0,0,100,,我和我的竹马在同一楼每次看到我都要笑一下一个人在我们班走过却每笑,5918615725,3,2023-06-05 15:54:37
给朕找个名字来,2004214640,0,1,230000,230700,,我语文不好都能看得懂，但是吹梦到西洲我是真看不懂，这歌主要写青梅竹马长大后分离，双方互相思念的故事,5918247046,0,2023-06-04 21:19:11
落花落_,1723000497,0,0,450000,450700,真的很感恩遇见你，从此生命里有了一束光，也很怨恨你，让我到现在都没舍得离开这个世界，还能孤独的仰望你。如果可以，你不要和我打招呼就好了。,高考加油！,5917757574,1,2023-06-03 23:21:52
水栗Q_Q,4896997742,0,2,0,100,,愿有前程可奔赴，亦有岁月可回首,5917396407,20,2023-06-03 10:36:32
acuozzz,517439664,0,2,310000,310101,无常如风起人生不可弃,好好听,5917346348,3,2023-06-03 07:59:48
马超枕边人,1326768153,0,2,0,100,,我和我竹马是亲戚，不存在这些,5916865114,0,2023-06-02 09:47:03
云匿Rachel-,1890070289,21,2,330000,330100,账号已注销,哇哇,5916689106,2,2023-06-01 23:05:26
camelbells7669,1677881250,0,0,330000,330100,,呵，我结婚的时候司仪问他追我的时候送过啥，他说送过饭[大哭],5916514916,0,2023-06-01 16:18:03
无良小木,100403884,29,1,330000,330500,,23年了，蹲个结局,5916376780,0,2023-06-01 09:08:29
陌久1903,1809918108,0,0,0,100,You can't be my poem， just as I can't be your dream. ​​​,好听,5916302915,2,2023-06-01 02:04:44
22啦O年年_,8008694320,21,2,0,100,你堕落了 ！—,让我赢一次,5916287446,1,2023-06-01 01:22:42
22啦O年年_,8008694320,21,2,0,100,你堕落了 ！—,你在哪,5916290104,1,2023-06-01 01:22:08
似霰花林,2007628741,19,2,610000,610100,Youth is valuable,高考加油！！,5915363963,1,2023-05-30 16:04:50
Meroko_纸鸢,1388765764,23,1,210000,210200,,好听,5915233116,2,2023-05-30 12:52:06
给朕找个名字来,2004214640,0,1,230000,230700,,私你了,5914433360,0,2023-05-28 21:01:04
给朕找个名字来,2004214640,0,1,230000,230700,,发不了图啊,5914431443,0,2023-05-28 21:00:50
给朕找个名字来,2004214640,0,1,230000,230700,,看歌曲光盘封面啊,5914430693,0,2023-05-28 21:00:35
见一眼秋桃刹那春,566533196,18,2,510000,510100,,谢谢你呀😘😘,5914369760,0,2023-05-28 18:42:47
婉婷在这呢,1546494241,19,2,420000,420600,一静候，再静候，就算失收始终要守,哇哇哇，好幸福[爱心]祝福祝福,5914271779,0,2023-05-28 15:02:21
寄个愁心与明月,1598770638,0,0,0,100,,睡不着来听歌,5914055011,1,2023-05-28 04:32:57
綿綿月-L,3271615888,20,2,0,100,“成为自己的光，照耀自己的月亮”🌙——我曾经会是一个人，未来我会是我自己想要的样子。“面朝希望曙光 退步万丈深渊 逆流而上方能百战不殆 就此止步风暴不期而至。”时至今日 年少时所拥有的一切仍令我难以忘怀，年华尚好 岁月无限，只要我们拥有彼此 周遭之物便形同虚设，驰骋向前 无问西东，然而浮云朝露 寸阴尺璧，我们也曾如此年轻。☽～“繁星若尘， 环绕着我以栩栩如生的光雾无垠的太空，仿佛在我眼前陡然乍现”✡︎——劉,风吹过我   我便乘风而去,5913546265,4,2023-05-27 11:02:22
煜舟舟舟,1956332245,18,0,1000000,1005500,如果你愿意让我陪伴，就请你拉住我的手，梦是遥远的群星，海浪激昂而又平静，我愿意陪你，只要你不嫌弃,因一首《空待》喜欢上王朝,5912750195,0,2023-05-25 20:27:34
某某小号i,428953149,0,0,0,100,及時行樂,往后都要快乐呀～,5912713239,0,2023-05-25 19:03:49
某某小号i,428953149,0,0,0,100,及時行樂,白月光,5912714098,1,2023-05-25 19:02:51
某某小号i,428953149,0,0,0,100,及時行樂,唱到你心里了叭[小红花],5912714828,1,2023-05-25 19:01:43
