爱音乐的壁纸君,473839929,24,1,120000,120101,爱生活，爱自己，不定期更新超清美图，动漫剪辑，acg动漫第一线预告！励志做一个云村宝藏!唯有音乐和动漫不可辜负(∗ᵒ̶̶̷̀ω˂̶́∗)੭₎₎̊₊♡十八岁极不靠谱男青年,“微风吹到窗外的梧桐树，阳光从玻璃窗外投进来，好像照耀了我心上的梦想，梦想是凌晨拿起笔的坚持，是掀进被子的毫不犹豫和冷水扑面的清醒，是6点看到旭日东升的惊艳，和笔记绽放的光。,5912431400,46,2023-05-25 10:54:31
芒果味的多巴胺_,8515825896,0,1,820000,820100,,绝了这首歌,5912387546,1,2023-05-25 08:19:37
硕鼠硕鼠无食我粟,8116863452,0,2,0,100,,不知道为什么，唱到第三句，眼里就流出了泪,5912304614,1,2023-05-25 00:34:55
Quitter_0,3858203187,0,2,360000,360800,,1,5912082547,0,2023-05-24 17:26:23
旧雨酒肆,567365442,0,0,320000,320100,,大学四年，这首歌是我的起床铃，以至于毕业后室友在听到这首歌的时候直接吐了[多多难过],5912077165,9,2023-05-24 16:58:13
云无心于,1475803644,33,0,330000,330100,,好可爱的歌词……让一部温馨的青梅竹马的故事在脑海里不断翻涌[多多大笑],5911727758,2,2023-05-23 21:23:23
阿巴阿巴_uASv,1859930931,0,2,370000,370200,,找到了 《还珠格格》里面的有一个姑娘 这个逛唐宋元明清那个 和这个调一模一样,5911497998,0,2023-05-23 10:05:47
逃不过你了,453275688,0,0,0,100,绕了这么一圈才遇到,你是我的风景 有几句简直照搬,5911411272,0,2023-05-23 01:05:45
假面_剑,3934011130,0,1,430000,430800,,蝉鸣啊,5911306061,1,2023-05-22 22:20:02
戴克阿维达,20598355,0,1,130000,130600,路走到尽头，左转是地狱，右转还是地狱！,银临女神,5911212654,1,2023-05-22 19:19:02
海葬蓝,1503601108,20,1,370000,370200,淡定,前天看《悦动青春》时，发现刚上大学我就已经找不到青春年少的青涩了，青梅竹马的故事在我这总是少一些味道。美好到找不到共鸣[多多捂脸],5910633450,1,2023-05-21 15:00:55
Toutlemonde6,636495532,6,2,1000000,1005500,最是人间惊鸿客,玄觞，叶里，不才，银临，双笙，囧菌，音阙诗听，云之泣，河图，黄诗扶，少司命，萧忆，…以前关注了好多古风歌手，现在都差不多取关了,5910406876,1,2023-05-21 02:07:43
Toutlemonde6,636495532,6,2,1000000,1005500,最是人间惊鸿客,以前当唱见还是不错的，现在当歌手了反而少了感觉,5910403040,0,2023-05-21 01:59:29
龙猫听,1949307333,0,0,0,100,独处时听音乐人会变得感性和冷静,祝好,5910121425,0,2023-05-20 19:23:47
一只徐徐鸭,453963884,0,0,0,100,可盐可甜，爱发疯少御音/爱看小说/唱歌要钱还跑调/宠粉直播时间不定直播不易拒绝白嫖，未成年禁刷8级粉团+V，5级进粉丝群,好好听[爱心],5909870079,1,2023-05-20 09:22:33
linda梓桐,380187899,0,2,430000,430100,“我梦见家国破碎到河清海晏，所思与所慕皆可如愿。”,怎么都在说青梅竹马，我觉得是两个女孩子美好的从小到大的感情诶,5909372911,5,2023-05-19 15:48:52
静_徐,3869615989,26,1,1000000,100,,加油,5907333789,0,2023-05-15 21:33:21
兿氲,2100653865,16,0,310000,310101,小时候幸福很简单，长大了简单很幸福,祝福~（爱心.jpg）,5906498991,0,2023-05-14 13:25:16
北辰-备考版,2046001725,0,2,310000,310101,蚍蜉虽小，亦可撼树,什么在叫？你们听到了吗,5906441202,0,2023-05-14 11:31:22
Ch_King,404878231,0,1,330000,330100,,这不是蜀绣的曲子吗,5905961473,0,2023-05-13 16:48:36
禾生安,320330192,22,2,0,100,,找到了！我以为我听错了,5905771082,0,2023-05-13 09:28:53
见一眼秋桃刹那春,566533196,18,2,510000,510100,,哇哇谢谢😘,5905498783,0,2023-05-12 20:59:12
_HAHA_x,498056267,21,2,1000000,1001300,清醒独立有暖气,我大学都要毕业了 时间好快,5905376092,0,2023-05-12 16:13:28
丞哥哥带我走,1596704576,23,2,370000,370100,在寂寞中长大，在孤独中老去,从小到大的外号就叫三明治[西西机智],5905341251,0,2023-05-12 14:31:30
江苏彭于晏本晏_,440949881,0,0,320000,321300,,_(:з」∠)_,5904269961,0,2023-05-10 11:36:05
NeverVoid,348257757,23,0,520000,522400,认真听一首歌就像在审视自己的内心，他好像在问你究竟想要什么？到底要做什么？还在放不下什么？一直纠结着什么？迟迟不敢面对什么？久久不忍忘却什么？好像在等音乐给你一个答案，又好像希望能给出答案。,因为现在的人从众心理越来越强烈了，很少有人还有自己的思考，都是别人说写的不行就是写的不行，很多人喷写的差自己也就觉得写的差。其实这些人很可悲，因为他们早就被同化却还不自知,5903860196,4,2023-05-09 14:59:15
很暖的阳光啊,574645771,22,1,310000,310101,鸟儿多自由,两小无猜，青梅竹马，无忧无虑，只会出现在歌中的童年,5903818739,1,2023-05-09 12:49:34
Brave-CHEERO,80178663,0,2,0,100,follow your heart,听出一种无忧无虑 00 后是幸福的,5903119764,1,2023-05-07 23:20:50
宋知夏-,536850273,22,2,410000,411300,回忆是把不存在的美好编进原本苍白的现实,加油！！！,5903104520,0,2023-05-07 23:09:25
宋知夏-,536850273,22,2,410000,411300,回忆是把不存在的美好编进原本苍白的现实,祝福！！！,5903103479,1,2023-05-07 23:05:52
Ny-Fran,626299548,8,2,320000,320500,,最后一句最浪漫了！🥹,5901778815,2,2023-05-05 15:20:41
l柠y汐g,1700406147,21,1,320000,320700,FPS玩家,我也没有青梅竹马啊，说个跑题的话，喜欢上个女孩不会追。。。太失败了我,5901593770,0,2023-05-05 02:44:37
小c要开心o,3352176004,18,2,350000,350200,眼泪是世界上最小的海,生日快乐哦🍰,5901288147,0,2023-05-04 16:40:55
见一眼秋桃刹那春,566533196,18,2,510000,510100,,啊啊啊啊五月四号成人礼准备穿蓝色流光记 随机到了也祝我生日快乐🥰🥰,5900280834,9,2023-05-02 17:18:55
东海岸蔷薇vs凡尔赛玫瑰,563642905,0,2,110000,110101,暖心小奶茶,无心的一瞥，遇到惊鸿，是最为惊艳的美，也最为致命。,5900067077,2,2023-05-02 08:58:12
-GOOD-ZHANG,1488932389,0,2,0,100,今宵酒醒何处？杨柳岸，晓风残月。此去经年，应是良辰好景虚设。便纵有千种风情，更与何人说？,可是这个歌词真的很俏皮啊喂！！！！不准他们这么说！！！,5899006085,3,2023-04-30 12:46:18
念着倒在你道知就我,1599413060,0,0,1000000,1005000,,还得是达利园绿茶青梅，绿茶配青梅还是头一回，绿茶青梅来相配天生还是头一对,5897873293,1,2023-04-28 10:51:05
六鱼ly,1752268244,18,2,330000,330600,0824与小波都是最爱,初中听的歌了现在大学了[爱心],5897528678,10,2023-04-27 18:48:55
云村村民166349897264629,8032611668,0,0,0,100,,00晚上,5896924933,0,2023-04-26 18:05:39
星沉尘心,320147923,27,1,610000,610100,爱意随风起，风止意难平。,总学不会别离。,5896886400,2,2023-04-26 15:53:49
LY凉枍,1946576381,0,1,440000,440100,回忆 不能回头,再也回不去了,5896604266,0,2023-04-25 23:10:46
LY凉枍,1946576381,0,1,440000,440100,回忆 不能回头,梦回初中。。,5896601537,2,2023-04-25 23:10:40
啊飞95,1832070832,0,0,440000,440100,,(๑>؂<๑）,5896580478,0,2023-04-25 22:38:05
怡怡单推人,1875094110,0,0,0,100,我们牵着手走向属于我们的未来。,“头顶月 眼中你”,5896406817,18,2023-04-25 16:09:50
导演yu,281084443,0,1,370000,370600,累？累就对了。舒服是留给死人的,流光记是为数不多我认为词写的很好的古风曲了,5896395288,1,2023-04-25 15:36:35
阿巴阿巴_uASv,1859930931,0,2,370000,370200,,这个调调好耳熟 在哪听过好像,5896278020,1,2023-04-25 09:24:05
--___-____-___--,1828642399,0,1,130000,130500,,[爱心],5896017215,0,2023-04-24 20:25:17
记得每天吃早餐丶,417045949,19,1,130000,130500,,@--___-____-___--,5896015404,0,2023-04-24 20:24:50
昭昭天汉,3860744015,0,0,0,100,天气阴转晴,三五二八时，千里与君同。,5895685199,0,2023-04-24 01:12:20
昭昭天汉,3860744015,0,0,0,100,天气阴转晴,三五二八时，千里与君同。,5895686209,0,2023-04-24 01:12:20
清都山水郎_ML,509992904,0,0,310000,310101,,银临！！！太好听了！！！！爱你！！！！！,5895326179,0,2023-04-23 13:16:58
MrPeab0dy,575235976,24,1,0,100,,这首歌是我们之前在一起滴时候听的，现在分手啦，但是还是很喜欢这首歌曲,5895319813,2,2023-04-23 12:58:03
仁桀宸,8462898613,33,1,510000,511300,,别人和青梅竹马是甜蜜两小无猜，而我和我的青梅竹马就是。他能为我两肋插刀，我能为他打架。从小一起嗨一起浪。自从上了初中，也没有再见了。,5894966023,1,2023-04-22 20:09:58
巴拉巴布丸子,1836469861,0,0,0,100,,大春天的听的我想过年,5894873756,1,2023-04-22 16:52:11
烟雨伴斜阳,8414367276,16,1,370000,371700,喜欢听歌,有风有景从身边经过，但是却没人陪我看啊,5894356384,0,2023-04-21 19:54:19
完全不会画画-和小美合影版,1654130449,0,0,0,100,,真的超级好听，没听过的人有难了！,5893868874,1,2023-04-20 21:22:37
灵修sweetheart,3558441288,13,2,0,100,❤️ 爱你。                                                           咿吖，栗子 你们都在吗,有过青梅竹马，可是那个人就那样，很短就三年吧，现在四年没见了大概，有缘千里来相会 无缘对面不相逢,5893851672,16,2023-04-20 20:58:51
望仙桥上痴人过,8083120275,0,0,440000,440400,,头顶月，眼中你，写得好,5893801520,8,2023-04-20 19:08:23
bysyatb1,2045308906,0,1,0,100,金牌会永远属于我的GOAT！                                                          “希望我以最优秀的姿态，走到世界的尽头！”,笑拉了我歌单里也有这首歌，果然我是喜欢同曲风的嘛哈哈哈,5892788789,1,2023-04-18 21:01:24
bysyatb1,2045308906,0,1,0,100,金牌会永远属于我的GOAT！                                                          “希望我以最优秀的姿态，走到世界的尽头！”,怎么办！我觉得这个真的好适合”虚颜”啊哈哈哈很像将军的气质诶嘿嘿嘿[呲牙],5892786396,1,2023-04-18 21:00:41
银临小仙女,250903847,26,2,440000,440300,银临小仙女是我的！,两小无猜，真好,5892466995,0,2023-04-18 00:17:47
迎风花开,115938807,30,1,410000,410300,,像何洁的《你是我的风景》,5892412485,0,2023-04-17 23:03:28
yooooungggg,1474785927,0,2,0,100,,超爱这首歌,5892397504,1,2023-04-17 22:42:34
伟大的咕咚国王嘞,325169761,0,0,0,100,爪巴.,尊吼,5891854519,0,2023-04-16 23:45:43
旎语木叶,1849805493,0,2,0,100,相信国家相信党！,加油啊,5891703761,0,2023-04-16 19:46:24
橘生又落valentia,3727270134,0,0,0,100,自在随心，想唱什么就唱什么～,因一首《昔言》喜欢上HITA；因一首《涉川》喜欢上不才；因一首《九万字》喜欢上黄诗扶,5891637467,4,2023-04-16 17:06:52
_67小羊,5034147338,0,0,440000,440300,,超级喜欢！！,5891451113,1,2023-04-16 10:37:32
Cytosine_Q,3929517946,0,0,0,100,,[流泪] 呜呜,5891446611,0,2023-04-16 10:30:49
Cytosine_Q,3929517946,0,0,0,100,,又  。。。,5891448246,0,2023-04-16 10:28:15
茶米Chemy,1351191935,16,2,110000,110101,心向璀璨。,反正我没有青梅竹马，不用担心哈哈哈哈,5891220305,0,2023-04-15 23:02:39
已经crazy掉了啦,1766800709,0,1,0,100,一般般的我一般般的拽,一直没联系过[流泪],5890985318,0,2023-04-15 15:43:31
smart_sTov,255087235,0,2,0,100,,哈哈那你多给她聊天,5890958376,0,2023-04-15 14:36:28
已经crazy掉了啦,1766800709,0,1,0,100,一般般的我一般般的拽,我去 ，你居然能看到 ，那时候是李霖菲让我听的[流泪]好久没提到她的名字了感觉有点陌生了[流泪],5890947989,0,2023-04-15 14:17:37
smart_sTov,255087235,0,2,0,100,,想谁了[憨笑],5890610120,0,2023-04-14 22:19:23
第二龙将,82931755,30,1,440000,440100,聆听这个世界的音乐,听了好多次，很喜欢临姐的歌。,5890468040,2,2023-04-14 18:01:35
MachidaHana,4023087613,0,2,0,100,,挺好听的 就是闭着眼一句歌词没听懂,5890305630,1,2023-04-14 10:10:27
Sirius尤加利,430260972,0,1,0,100,“想哭的时候就向天空大喊，那些我来不及跟你说的话，就让风说给你听.”,古风人DNA动了[大笑],5890272872,0,2023-04-14 08:01:56
云中醉卧,8007711169,0,1,0,100,梦醒之后，梦中如何，便忘干净。,@w司南喃喃喃 铁勺什么时候可以安排上啊啊啊啊啊啊啊啊,5889989092,1,2023-04-13 19:02:02
云中醉卧,8007711169,0,1,0,100,梦醒之后，梦中如何，便忘干净。,“岁月走走停停，没写出游记，却把心事点一朵涟漪” 太真实了,5889977380,46,2023-04-13 18:36:22
我控记不住我记几啊丶,360438095,29,1,310000,310101,,我身边没有牛马，但是我朋友身边有[吐舌][吐舌][吐舌],5889935692,0,2023-04-13 16:23:36
已经crazy掉了啦,1766800709,0,1,0,100,一般般的我一般般的拽,以前上高中同学推荐的歌 ，现在有点想念女生[流泪],5889795449,1,2023-04-13 08:04:40
2002LJQ,1763019685,0,2,440000,440500,,早八歌曲，好好听,5889795350,0,2023-04-13 08:02:08
-流云吻风-,1894098929,0,2,420000,420100,,就当他是依托答辩[便便],5889664051,0,2023-04-12 23:11:28
云深不知处ly,1287198705,0,2,0,100,,好喜欢最后一句[多多耍酷],5889272436,0,2023-04-12 12:08:16
眉间如花妳如画,378874808,23,1,430000,430500,愿你看遍星河，仍会选择这片海,我早已浮游天地，也曾海运南溟，何时木落雁归,5888287836,0,2023-04-11 01:32:37
从前有个emmm,1922073457,0,0,230000,230100,,这首歌有一种少女在暖洋洋的流淌时光里捡拾回忆的感觉，听着心里很舒服。,5888154629,7,2023-04-10 22:15:17
金戈2106,5062471957,0,2,340000,340100,,可惜啊，我把我的小竹马在记忆里弄丢了……,5887920965,1,2023-04-10 12:54:37
熙仔的麻辣兔头,7808607504,18,2,210000,210200,,+10086,5887156473,0,2023-04-09 14:57:58
熙仔的麻辣兔头,7808607504,18,2,210000,210200,,还真是  事真多,5887155370,0,2023-04-09 14:56:13
孤零2206,6406496926,0,2,410000,411300,,真奇怪，刚看到一条狗冲我叫，不过看在他是狗的份上，暂且绕了吧[可爱],5886987517,1,2023-04-09 10:21:23
锦依卫御绫军,322761488,20,2,350000,350100,喜欢天依的第十一年,睡了,5886900518,1,2023-04-09 04:33:42
赵等等等等等等等,258752264,0,2,610000,610100,第113天内...,现实中遇到的全是薄情或负心人 也不知道网易云这些深情的人都在哪里呢,5885225024,0,2023-04-07 14:18:52
kayn和拉雅斯特的爱情故事,7995563914,21,0,430000,430300,,看耳机吧,5884342921,0,2023-04-06 08:03:16
流水线海洋,1912856763,0,0,0,100,心脏埋进废墟,我那时候也好喜欢,5884281277,0,2023-04-06 01:23:11
香菜味的香菜,123761473,0,1,0,100,Bye my baby blue.,真的[流泪][流泪],5884185076,0,2023-04-05 23:18:00
Bdm大米,559996546,0,2,0,100,知足常乐,同问,5884183233,0,2023-04-05 23:15:29
小椒易,6272752568,15,1,430000,430500,👀,是百合吗,5884019351,2,2023-04-05 19:59:33
游乐_子云,299163851,21,1,410000,410100,刚好遇见你是对我多幸运！,分开才是真的痛苦,5883877756,0,2023-04-05 16:18:53
独行YRJ,252803952,29,1,330000,331000,红衣佳人白衣友，朝与同歌暮同酒。,用什么音效听比较好,5883775103,0,2023-04-05 13:29:14
Lichi_John,296681518,27,1,1000000,1000100,人生忽如寄，莫负茶汤好天气。,喜欢一个人，他好像也喜欢我哎，但两个人不是喜欢就能在一起的呀。,5883197275,3,2023-04-04 19:29:32
影悬,253924343,20,1,520000,520300,鱼在深泉鸟在云，从来只得影相亲,羡慕,5883019469,1,2023-04-04 13:32:29
废萌猎,5189543172,0,0,150000,150100,,好喜欢这句“逛一圈东周演义山中魏晋唐宋元明清”。[爱心],5882750622,0,2023-04-04 00:18:15
木子斤欠舟亢,338890758,25,1,420000,420100,那平淡如水的生活，因为小茹而火热,同居长干里，两小无嫌猜——李白,5882145898,1,2023-04-03 07:37:32
自是别有,633999619,23,1,610000,610100,我看到的世界你们看不到,之前不是有首梦游天姥吟留别，有个喷子喷作词一般不押韵，李白要是活着不得把靴子丢他脸上,5881933599,1,2023-04-02 23:37:37
是想接近,2046037717,0,2,520000,520100,烂牌摸多了 自然不在乎输赢,哈哈哈我都喜欢,5881575768,0,2023-04-02 16:39:56
Reureka,1832811587,0,0,0,100,心怀若谷，风禾尽起,倒也没错[大哭][大哭],5881062840,0,2023-04-01 21:46:12
Layceni,381901730,0,1,0,100,常听常喜，银临子❤,每次  每次   我都想听银临子的歌,5880753233,0,2023-04-01 12:09:13
Mario丶喵,1292380237,0,2,440000,440700,,今天听到一首抄旋律的《清风把月揉》，可把我恶心坏了,5880555666,0,2023-04-01 04:09:20
y2k电子垃圾,1607733582,0,0,0,100,雨是神的烟花，温热流淌的心,[亲亲]好听爱听,5880481877,0,2023-04-01 00:49:03
慧子hhy,6344831778,19,2,1000000,1010000,,好像下午永远有着温暖阳光的童年，什么也不懂对一切好奇的孩子跑来跑去，对这个世界有成年人看不到的烂漫幻想。喜鹊偷懒，先生教的之乎者也比不上百草园的知了叫，抱着一本书边疑惑边看得津津有味——未来还好远，天地也还小,5880371990,2,2023-03-31 22:49:19
日记_TWNp,8473572696,0,1,0,100,,想你的好 想你的爱,5880339978,0,2023-03-31 22:18:13
日记_TWNp,8473572696,0,1,0,100,,回来 我们复合 我说的,5880339089,0,2023-03-31 22:07:42
日记_TWNp,8473572696,0,1,0,100,,恩 都不主动,5880339933,0,2023-03-31 22:07:00
日记_TWNp,8473572696,0,1,0,100,,世界好乱 好想你在我身边,5880338960,0,2023-03-31 22:06:48
日记_TWNp,8473572696,0,1,0,100,,闯进来的是你 困在回忆里的是我.,5880338917,0,2023-03-31 22:06:27
日记_TWNp,8473572696,0,1,0,100,,爱要及时 别总说下次.,5880337052,11,2023-03-31 22:06:11
日记_TWNp,8473572696,0,1,0,100,,我总回望过去可真正离开的人从不回头,5880338759,0,2023-03-31 22:05:25
娘口desu,252592436,0,0,310000,310101,爱音乐爱游戏 是个普通鸽子 随游戏淡季更新 你说我垃圾我也说你,[心心],5879902859,0,2023-03-31 10:24:36
巴啦啦小糖豆,609861610,0,0,0,100,花花瓜瓜猫咪猫咪哄,梦回初中[流泪][流泪][流泪],5879516846,0,2023-03-30 19:00:05
蓝色的蟹子,3324258160,20,0,370000,371700,,画面感悦然纸上的感觉，理想中的故事,5879184647,0,2023-03-29 23:17:15
临风_待月,386308276,0,2,410000,410200,,了ebu哦里咯啦啦啦啦咯哎，^_^41tkul了,5879017240,0,2023-03-29 17:43:54
林慕瑾,8467806075,0,0,0,100,,不逃课按时完成作业准时到校但学不学就是我的事咯.,5878950162,0,2023-03-29 13:48:48
林慕瑾,8467806075,0,0,0,100,,我不会为你沉迷 大女主只爱自己,5878949279,0,2023-03-29 13:48:04
林慕瑾,8467806075,0,0,0,100,,本小姐才是你在废墟的唯一信仰,5878950964,0,2023-03-29 13:46:54
林慕瑾,8467806075,0,0,0,100,,好好监视我哦，以后的文案都是你.,5878949213,0,2023-03-29 13:46:15
林慕瑾,8467806075,0,0,0,100,,没有看不起你啦 根本就没看过你,5878949990,0,2023-03-29 13:45:12
林慕瑾,8467806075,0,0,0,100,,会内涵是我的本事对号入座是你的错.,5878946401,0,2023-03-29 13:44:40
林慕瑾,8467806075,0,0,0,100,,懒得解释，也不想和你产生共鸣，你定义不了我,5878948166,0,2023-03-29 13:43:49
林慕瑾,8467806075,0,0,0,100,,别定义我的风格 生在广西玩的就是性格.,5878949079,0,2023-03-29 13:43:28
林慕瑾,8467806075,0,0,0,100,,你说 我听 不改.,5878946319,0,2023-03-29 13:42:59
秋律,128999017,0,0,0,100,学习和听歌使我快乐。,虽然但是，喜欢不知道早点说吗？把人家从婚礼上抢走让新郎怎么想?这种只顾自己出风头的自私鬼还是别搞这些名堂好了,5878875065,1,2023-03-29 09:54:54
白车轴草Kuruma,529968277,0,0,0,100,戻らない後悔の全部が美しいって.BV1zs411T7ot,风灵玉秀.,5878786073,0,2023-03-29 01:29:07
kayn和拉雅斯特的爱情故事,7995563914,21,0,430000,430300,,歌荒了，求一首好听的古风歌，谢谢大佬们QWQ,5878531170,0,2023-03-28 18:25:07
绿岸水蓝,16875244,0,2,0,100,是梦也是真实。,隔壁那首曲子真的很好听,5878492341,0,2023-03-28 16:45:14
绿岸水蓝,16875244,0,2,0,100,是梦也是真实。,我觉得流光记的词好。贴切。^_^,5878495858,0,2023-03-28 16:42:23
六十九夜缚心,320133611,0,2,1000000,1010000,听音乐不听歌 听歌不听音乐  (),太美好的青梅竹马,5877647781,4,2023-03-26 22:00:56
zshu-x,3877083461,17,2,330000,330200,耶,加油加油(๑Ő௰Ő๑)生活会越来越好呀,5877330814,0,2023-03-26 11:24:27
北宇治吹奏部,4057160444,0,1,130000,130500,,太好听了[多多大笑],5876639398,1,2023-03-25 07:53:17
Kelymacaron,441293108,0,2,420000,420100,开朗着发疯。,我不是不婚主义者，我只是幸福主义者[跳舞],5875664606,1,2023-03-23 19:44:25
抑系不乖,2095476294,19,2,410000,410100,没有从天而降的神明，只有挺身而出的凡人，你以凡人之躯，比肩神明.,祝福祝福,5875399082,0,2023-03-23 10:06:25
抑系不乖,2095476294,19,2,410000,410100,没有从天而降的神明，只有挺身而出的凡人，你以凡人之躯，比肩神明.,绝了！！！,5875401890,0,2023-03-23 10:06:21
elieeeeeeeen,8057269808,0,0,310000,310101,,这是我初中6.7年纪最喜欢的歌，那会天天循环播放这首歌，时间过的好快 不知不觉已经高中了[呆][呆][流泪],5875205210,25,2023-03-22 22:35:49
鑫源xiny,509678928,0,0,0,100,愿：命途风霜尽，乾坤气象和，历添新岁月，福满旧山河。,齁甜齁甜的一首歌,5874530427,4,2023-03-21 14:37:50
不考上七林不改名,5212432867,3,1,1000000,1010000,未曾谋面的终会相遇,说实话一直无法想象青梅竹马在一起的样子……我感觉两个人太熟了真的没办法心动，距离产生美吧哈哈哈,5874263847,1,2023-03-20 22:43:08
石原里美最爱,117871037,28,1,360000,360400,石原さとみは大好きですね！,没文化的人当然要没文化得东西去满足,5874166229,0,2023-03-20 20:09:07
石原里美最爱,117871037,28,1,360000,360400,石原さとみは大好きですね！,甜到爆得一首歌，怎么能这么甜,5874163378,0,2023-03-20 20:07:46
幺花井,1850553666,4,2,450000,450100,,听完这首歌我就去吃饭,5874101512,1,2023-03-20 17:25:40
航向你的海岛,421441037,24,1,0,100,我睡觉的时候不困,路漫漫，心悠悠。君去东方不归头，何时才能同西行。愿我如云君如日，日日相随无别离。日有暮，云常在。待日复升起，双双共缠绵。,5873340162,4,2023-03-19 10:03:37
Eccentric99,636533725,0,2,0,100,,我们要相信这个世界存在普遍性的东西，而我们在世上，总能找到承认我的人，拥抱我的人。我始终相信每个人都有光明的前途，这不是祝福或是预言，而是我们生来应该如此。生活在阴沟，也有仰望星空的权利。,5873228019,1,2023-03-19 01:01:54
Eccentric99,636533725,0,2,0,100,,无论如何 努力活在当下，没有什么比你自己更重要。生活有太多可能，而你被压抑了太久，你有太多的选择可以尝试、探索。不要觉得自己的痛苦没人理解，我们都知道鲁迅说过人类的悲欢并不相通，我只是觉得他们吵闹。但很少有人知道，鲁迅还说过，无穷的远方，无数的人们，都和我有关。,5873223247,5,2023-03-19 00:59:10
十一劃-_,119320116,0,1,0,100,朋友十二画，恋人十二画，爱人十二画，家人十二画，所以，十二的名字叫难忘；我把昵称改成十一，因为差那么一画，所以，十一的名字叫遗憾，铭记此生所有的遗憾。,……,5872877641,0,2023-03-18 15:38:44
废呀_,1726308884,0,0,1000000,1004000,，，，，,满满回忆,5871946955,0,2023-03-16 22:05:01
Asukayanami_,1542223054,0,2,0,100,流水落花春去也,在哪都能看到你,5871923387,0,2023-03-16 21:32:20
皓雪恋,34746010,0,1,0,100,,郎骑竹马来，绕床弄青梅。同居长干里，两小无嫌猜！（《长干行》唐·李白）,5871699690,2,2023-03-16 11:15:54
十一劃-_,119320116,0,1,0,100,朋友十二画，恋人十二画，爱人十二画，家人十二画，所以，十二的名字叫难忘；我把昵称改成十一，因为差那么一画，所以，十一的名字叫遗憾，铭记此生所有的遗憾。,朋友十二画，恋人十二画，爱人十二画，家人十二画，所以，十二的名字叫难忘；我把昵称改成十一，因为差那么一画，所以，十一的名字叫遗憾，铭记此生所有的遗憾。,5871477356,3,2023-03-15 21:53:46
寂雪莫苏,10202810,29,1,110000,110101,分享热爱，热爱生活，失眠艺术家,是会开车在傍晚回家路上听的,5870305693,1,2023-03-13 16:15:12
雨滴打湿罗衣,318754229,0,2,0,100,,或许有过早恋的人才会感触这首歌吧,5869985578,1,2023-03-12 22:13:52
九千月-,5220063413,14,2,370000,371000,一起去看海吗？,加油！,5869889398,1,2023-03-12 19:32:54
九千月-,5220063413,14,2,370000,371000,一起去看海吗？,为什么不亲自告诉他你是小时候他对门！！！,5869889529,0,2023-03-12 19:28:29
红尘远走,3941307951,0,1,110000,110101,,缺点就是这么写太耗灵气了，我怀疑这与吃吃的低产有极大关系,5869657635,0,2023-03-12 11:34:24
山谷里的铃儿响铃铛,434394507,26,2,1000000,1001300,坐在月亮上，听星星讲故事,这几个倒霉孩子，天天拿夫子开玩笑[鬼脸],5869599960,0,2023-03-12 09:19:39
