繁花落尽纸上花开,1714929423,0,0,320000,320100,,你们还没有什么好1129,5869575002,0,2023-03-12 08:04:41
幺花井,1850553666,4,2,450000,450100,,哈哈哈哈哈,5869397864,0,2023-03-11 22:45:03
鱼藻0317,597718791,24,2,120000,120101,,怪不得，我觉得词和人间不值得风格很像，果然是同一位词作！好厉害！,5869326516,5,2023-03-11 21:08:17
_James-Challis-Potter_死了,385885867,0,2,1000000,1001900,有关必回，取关私信，脾气很大能处处不能处滚。（我是女生，某些作精请别来理我谢谢）。    我担：哈迷/稻米/周杰伦/唐探/小雀斑/甜茶/戳爷/ 霉霉。cp杂食：hp鹿犬、thesewt、adgg、风昊/昊风、哈赫、甜戳、燃晚。雷：德哈、罗赫、哈金。   老婆：Pads、Moony。闺蜜：卢娜、赫米子、七七、护树罗锅、绿草、Seporina。儿子/女儿：马尔福、破特、Jasscia。孙女/孙子：斯卡曼德家嗅嗅、解语花。我是破特他爹，小号是忒修斯斯卡曼德,故乡的百合花开了[奸笑]，哦不对，就没谢过,5869027501,1,2023-03-11 10:39:11
_James-Challis-Potter_死了,385885867,0,2,1000000,1001900,有关必回，取关私信，脾气很大能处处不能处滚。（我是女生，某些作精请别来理我谢谢）。    我担：哈迷/稻米/周杰伦/唐探/小雀斑/甜茶/戳爷/ 霉霉。cp杂食：hp鹿犬、thesewt、adgg、风昊/昊风、哈赫、甜戳、燃晚。雷：德哈、罗赫、哈金。   老婆：Pads、Moony。闺蜜：卢娜、赫米子、七七、护树罗锅、绿草、Seporina。儿子/女儿：马尔福、破特、Jasscia。孙女/孙子：斯卡曼德家嗅嗅、解语花。我是破特他爹，小号是忒修斯斯卡曼德,我也逝[大哭],5869027396,1,2023-03-11 10:37:41
李锦洁加油,1564574937,0,0,0,100,海风依依 分辨你的气息,回不去了,5868983762,0,2023-03-11 08:33:14
_James-Challis-Potter_死了,385885867,0,2,1000000,1001900,有关必回，取关私信，脾气很大能处处不能处滚。（我是女生，某些作精请别来理我谢谢）。    我担：哈迷/稻米/周杰伦/唐探/小雀斑/甜茶/戳爷/ 霉霉。cp杂食：hp鹿犬、thesewt、adgg、风昊/昊风、哈赫、甜戳、燃晚。雷：德哈、罗赫、哈金。   老婆：Pads、Moony。闺蜜：卢娜、赫米子、七七、护树罗锅、绿草、Seporina。儿子/女儿：马尔福、破特、Jasscia。孙女/孙子：斯卡曼德家嗅嗅、解语花。我是破特他爹，小号是忒修斯斯卡曼德,青梅不一定是女友吧……,5868797789,0,2023-03-10 22:24:21
碎碎平安黏黏有余,1394362409,20,2,330000,330100,唯BJYX,确实是李白的,5868628816,0,2023-03-10 16:27:17
好想养猫-_-,3828406050,0,0,130000,130100,,古风歌单突然放到这一首，是无论听多少遍都惊艳的存在,5868502480,1,2023-03-10 10:09:03
北大清二,8130309752,14,1,110000,110101,pkc，等我,我的错吗？为什么我记得是李清照？,5868285207,1,2023-03-09 22:06:46
一个纯洁的人a,355086629,27,1,410000,410100,,芙蕖🪷,5868219164,0,2023-03-09 20:14:49
森森的猹,1467738309,0,2,0,100,,我刚刚在上一首歌提拉米苏里看到这个，不过是男版的,5868020791,0,2023-03-09 10:13:14
融小卜,1776766227,0,2,650000,650100,,青梅竹马，两小无猜。,5866898823,1,2023-03-07 01:32:19
阿数我好爱你,6401391408,0,2,460000,460100,,谁懂啊，抖音刷了好多古风圈老歌，真的好喜欢,5866221207,3,2023-03-05 20:18:34
甘将星辰缀满天,2068874495,0,2,0,100,生活的温柔总会哒哒哒地跑进你怀里的,你是魔鬼吧,5866179232,1,2023-03-05 19:11:20
热爱童话世界ly,8116366219,0,2,610000,610100,,嗯嗯,5865464961,1,2023-03-04 16:28:29
A给苏苏买可爱多吗,1480354075,0,2,0,100,希望有人觉得认识我是一件很棒的事,想回到初中的时候,5865451340,2,2023-03-04 16:00:06
iiu20-,4935865774,0,2,500000,500101,,想半天 只想出“好听”二字来形容这首歌👉👈,5865297022,6,2023-03-04 10:32:11
带我打王者嘛,252799719,24,2,330000,330200,,谁懂啊已经是初中时候的歌了 偷偷拿电脑看小说。然后还要听着爸爸妈妈回来的声音。周六下午永远是最喜欢的时间,5865281749,3,2023-03-04 09:55:42
芝麻_zm,246739141,0,2,440000,440500,,听说加油💪,5865001292,0,2023-03-03 21:07:19
芝麻_zm,246739141,0,2,440000,440500,,听说加油💪,5864996646,0,2023-03-03 21:07:13
芝麻_zm,246739141,0,2,440000,440500,,英语听说加油💪,5864998549,0,2023-03-03 21:07:05
愉越,77456936,35,1,440000,440600,希望自己越来越快乐,中国歌。,5864758013,0,2023-03-03 11:22:19
看客_egZ3,1808920134,22,1,120000,120101,,我有满心欢喜,5864624605,0,2023-03-03 00:56:46
灼777,545796193,20,1,420000,421000,,头顶月，眼中你,5864158684,0,2023-03-02 12:13:45
godvshy,1750480808,19,1,340000,341800,言念君子，温其如玉,长亭又短亭，几人懂别离,5863842331,3,2023-03-01 19:40:28
流光记___,509111269,1,1,440000,440100,Life Is a Fucking Movie,来吧,5863801510,0,2023-03-01 17:55:26
你听时光如歌,57076406,0,2,510000,510100,收音机靠坐在床头,月亮舟楫，驮来天星。听着好熟，和《你是我的风景》的几句好像。你就是我的风景，云高风清，很像。,5862833022,0,2023-02-27 18:26:44
杀手Rachel,1752709840,0,0,0,100,这家伙也太可爱了吧！,复制粘贴多少次了╮( •́ω•̀ )╭,5862539254,0,2023-02-26 23:45:12
看我在乱逛请让我滚去学习,1513760794,20,1,130000,130100,211本科在读狗，只是一个喜欢听歌的普通人,时光易逝，原来没仔细看过歌词，今天仔细看倒是有些感慨,5862297350,2,2023-02-26 16:49:35
优一得斯,2071394027,19,2,210000,210200,,祝福,5862262521,0,2023-02-26 15:29:05
我和魏大勋的日常,489361414,0,2,0,100,爱只能在回忆里完整,这周放学校广播上去,5862175072,1,2023-02-26 12:23:45
上杉绘梨衣啊_,451266708,17,2,440000,445200,,郎骑竹马来，绕床弄青梅，同居长干里，两小无嫌猜,5862089280,1,2023-02-26 09:30:28
言葉Aoki,564162502,0,1,340000,340700,Never let U go. Never let me down.,蒋佳琪我想你了,5862044332,0,2023-02-26 05:51:34
厌线,1800836849,0,2,810000,810100,如果无法共鸣 那我选择独行,好幸福，祝福你们,5861750441,0,2023-02-25 19:10:19
一只猪兔子zz,472247986,0,2,0,100,一只兔子,重回中学时代,5861724215,0,2023-02-25 18:11:05
茴香豆两碗酒,409128701,0,2,0,100,,谁懂啊[流泪]小图看封面还以为是老君和清凝,5861585669,9,2023-02-25 13:19:02
超级CY_,530548599,0,0,1000000,1010000,,一起加油！希望我北电上岸[拜],5861364827,2,2023-02-25 00:23:00
正版揺乱mio,1369746495,0,2,0,100,皓腕凝霜雪,这首词曲都好棒！,5861040487,3,2023-02-24 14:40:11
噗嗤嗤嗤噗哎,1529583543,0,2,320000,320300,很高兴遇见你~,因为他现在不喜欢我呀 我的热情终于被耗光啦,5860787074,0,2023-02-23 23:51:38
想自由的像风,1382719954,0,2,0,100,横扫道德，做回自己,怎么说呢，无忧无虑的感觉,5860325842,0,2023-02-23 10:36:02
想要轻薄饼啊,390398272,0,2,1000000,1010000,美梦非梦 常安浮生梦,古风入门 真的听不腻,5860286514,1,2023-02-23 09:04:00
释抡,3931559904,17,1,340000,340800,辽宁抚顺人。,思想了啊。谢谢银临。让我在为学业求生的路途中，暂缓了我的乡愁。,5860161441,1,2023-02-22 23:44:30
九生_2DXM,7818823055,0,0,370000,371100,,九,5860122228,0,2023-02-22 22:45:17
瘾春,1577435149,24,2,330000,330100,,嘴型是否到位以及发声方式影响蛮大的,5859975816,0,2023-02-22 18:01:36
瘾春,1577435149,24,2,330000,330100,,同感。然后我对着歌词仔细听了听，发现问题在于发音咬字不够满、不够清晰，不信你可以读一遍词，再对比一下唱的，区别还是很明显的。,5859976749,1,2023-02-22 18:00:45
虫洞漂流客,483366318,26,0,320000,321200,承天之佑，静影沉璧––承影,被谁说,5859889662,0,2023-02-22 13:55:14
好一似扬子江,1814655337,0,1,450000,450700,致我的诗与花与酒与短暂夏季 致我的澎湃爱意与浪漫主义,迟意yyds,5859793183,0,2023-02-22 09:05:28
看客_egZ3,1808920134,22,1,120000,120101,,[多多比耶][多多比耶],5859681725,0,2023-02-22 00:07:47
是浔箫呀,3236104662,15,2,360000,360700,你若满目是河，流年似水又如何。,你得知道，并不是所有的青梅竹马都是好的[大哭][大哭],5858924042,0,2023-02-20 20:24:23
是浔箫呀,3236104662,15,2,360000,360700,你若满目是河，流年似水又如何。,我不理解大家为什么要笑啊？难道就没有想到过那些被堕胎或者被扔掉等的女孩子？不然网友的这个村，怎么可能方圆500米都没有女孩子？难不成这是个男儿村啊？,5858923464,0,2023-02-20 20:22:57
是浔箫呀,3236104662,15,2,360000,360700,你若满目是河，流年似水又如何。,我的青梅竹马，小时候和我一起炸牛粪，长大后一起挨打，两个人的鬼点子，一个比一个多。简直不把我当女的。,5858922752,1,2023-02-20 20:18:49
TWILITY,362965745,0,1,360000,360400,,郎骑竹马来，绕床弄青梅。同居长干里，两小无嫌猜,5858810015,0,2023-02-20 15:04:47
什么时候能去看海捏233,476821425,0,0,410000,419001,,头顶月 眼中你,5858790533,0,2023-02-20 14:00:28
_18dB,4995788291,0,0,820000,820100,我吞下一只死去的蝴蝶 索吻腐朽的夏日 胜过有意的春天,3年了[珍宝],5857796363,0,2023-02-18 20:18:53
_James-Challis-Potter_死了,385885867,0,2,1000000,1001900,有关必回，取关私信，脾气很大能处处不能处滚。（我是女生，某些作精请别来理我谢谢）。    我担：哈迷/稻米/周杰伦/唐探/小雀斑/甜茶/戳爷/ 霉霉。cp杂食：hp鹿犬、thesewt、adgg、风昊/昊风、哈赫、甜戳、燃晚。雷：德哈、罗赫、哈金。   老婆：Pads、Moony。闺蜜：卢娜、赫米子、七七、护树罗锅、绿草、Seporina。儿子/女儿：马尔福、破特、Jasscia。孙女/孙子：斯卡曼德家嗅嗅、解语花。我是破特他爹，小号是忒修斯斯卡曼德,[奸笑][奸笑][奸笑],5857722999,1,2023-02-18 18:24:23
l_松,307850734,0,0,500000,500233,,6,5857710167,1,2023-02-18 18:00:19
koliiii,1754767774,20,2,430000,430200,Thug.,你不是一个人,5857251537,0,2023-02-17 22:30:02
_James-Challis-Potter_死了,385885867,0,2,1000000,1001900,有关必回，取关私信，脾气很大能处处不能处滚。（我是女生，某些作精请别来理我谢谢）。    我担：哈迷/稻米/周杰伦/唐探/小雀斑/甜茶/戳爷/ 霉霉。cp杂食：hp鹿犬、thesewt、adgg、风昊/昊风、哈赫、甜戳、燃晚。雷：德哈、罗赫、哈金。   老婆：Pads、Moony。闺蜜：卢娜、赫米子、七七、护树罗锅、绿草、Seporina。儿子/女儿：马尔福、破特、Jasscia。孙女/孙子：斯卡曼德家嗅嗅、解语花。我是破特他爹，小号是忒修斯斯卡曼德,哈哈哈哈哈哈哈哈[大哭]，总比我一个被青梅竹马抛弃了的强[大哭]。我上次和ta见面时ta只顾着打游戏；这次见面我和我对象发着语音撒着狗粮来见ta,5857193995,1,2023-02-17 21:07:48
_James-Challis-Potter_死了,385885867,0,2,1000000,1001900,有关必回，取关私信，脾气很大能处处不能处滚。（我是女生，某些作精请别来理我谢谢）。    我担：哈迷/稻米/周杰伦/唐探/小雀斑/甜茶/戳爷/ 霉霉。cp杂食：hp鹿犬、thesewt、adgg、风昊/昊风、哈赫、甜戳、燃晚。雷：德哈、罗赫、哈金。   老婆：Pads、Moony。闺蜜：卢娜、赫米子、七七、护树罗锅、绿草、Seporina。儿子/女儿：马尔福、破特、Jasscia。孙女/孙子：斯卡曼德家嗅嗅、解语花。我是破特他爹，小号是忒修斯斯卡曼德,加一,5857192207,1,2023-02-17 21:04:39
虚翼扬eEXM,450531177,16,1,310000,310101,一个孤独的全能型音痴,臣非卿竹马，卿亦非臣青梅，共赏乐音时点此曲何为？[惶恐],5856643916,2,2023-02-16 21:22:22
气态不饱和烃,126571252,0,2,110000,110101,南风知我意，吹梦到西洲。,呜呜呜 对！超级巧,5856481004,0,2023-02-16 14:16:54
_James-Challis-Potter_死了,385885867,0,2,1000000,1001900,有关必回，取关私信，脾气很大能处处不能处滚。（我是女生，某些作精请别来理我谢谢）。    我担：哈迷/稻米/周杰伦/唐探/小雀斑/甜茶/戳爷/ 霉霉。cp杂食：hp鹿犬、thesewt、adgg、风昊/昊风、哈赫、甜戳、燃晚。雷：德哈、罗赫、哈金。   老婆：Pads、Moony。闺蜜：卢娜、赫米子、七七、护树罗锅、绿草、Seporina。儿子/女儿：马尔福、破特、Jasscia。孙女/孙子：斯卡曼德家嗅嗅、解语花。我是破特他爹，小号是忒修斯斯卡曼德,组织！,5856120195,1,2023-02-15 20:44:48
Cathleen慧子,1877909948,21,2,320000,321100,与音乐🎵结缘愿美好常伴身侧,哇噢 好巧 这首歌就是讲青梅竹马呢,5855995453,0,2023-02-15 15:25:37
笨拙的二哈,285947063,0,1,420000,420600,再不疯狂我们就老了.....,“我寻你寻不到归期我梦里梦你的眼睛如若一念倾心 待何时难临”岁月里，是我来晚了，还是你走早了，总之，我们还是散了，时光很匆忙，我们要认真的老去……“一季烟雨凉秋  换轻纱拂袖而我徒留  残城碎梦”,5855702277,2,2023-02-14 23:37:56
气态不饱和烃,126571252,0,2,110000,110101,南风知我意，吹梦到西洲。,我和我的竹马在海底捞吃火锅的时候听到了这个！！！,5855457092,1,2023-02-14 16:46:15
浮白191006,2003534144,0,1,130000,130700,,第一次看词，发现好多典故象征和引用，很有水平,5855184164,0,2023-02-14 10:22:06
戴着红耳机的绿猫,3867836081,0,0,0,100,飞不动啦，就目前的莫名情绪来说，能活一天是一天,纯粹的不能再纯粹,5855133680,1,2023-02-14 07:43:49
戴着红耳机的绿猫,3867836081,0,0,0,100,飞不动啦，就目前的莫名情绪来说，能活一天是一天,青梅竹马可以不是爱情吧，我和他发展成了纯粹的兄弟情！[头秃],5855133634,2,2023-02-14 07:43:26
别时钟磬,608657650,0,0,0,100,宿雨逢山寺 行舟遇古桥,总学不会别离啊，也许永远都学不会,5855011174,1,2023-02-14 00:17:45
马掌望台_,1949753827,0,0,0,100,此身合是诗人未，细雨骑驴入剑门,我一男的也爱听,5854254295,1,2023-02-12 18:50:21
帐号已注销,1670584085,无,无,无,无,无,东周演义哈哈哈哈，可以可以,5854028034,0,2023-02-12 11:13:40
Resna_,86025489,0,2,0,100,每一个Pluto都会有它的Charon,12:09,5853403124,0,2023-02-11 12:09:07
苏小蓝Y,3581678052,0,2,110000,110101,,我的竹马已经有了他的女孩儿,5853351569,1,2023-02-11 10:28:22
小狗拯救世界丷,443452880,0,2,110000,110101,,没有青梅竹马的躲在角落默默哭泣[流泪][流泪],5853201506,0,2023-02-11 00:32:31
桉柉-170628,528260860,0,2,0,100,,就是像，前奏抄的[西西疑问],5852932542,0,2023-02-10 17:21:47
橘生又落valentia,3727270134,0,0,0,100,自在随心，想唱什么就唱什么～,哈哈哈哈哈哈哈哈哈哈哈哈哈哈,5852859136,0,2023-02-10 14:06:48
羽舟舟舟舟,3256475063,4,2,520000,520400,人值得用一生去等一朵花开,抱抱，加油加油,5852452484,0,2023-02-09 19:58:14
羽舟舟舟舟,3256475063,4,2,520000,520400,人值得用一生去等一朵花开,啊啊啊好会说,5852458829,3,2023-02-09 19:55:13
我是宫村的---,1745309948,0,2,0,100,要打败大魔王哦,高中的时候和同学聊天，那个同学说水星记好听，我说我没有听过，听过流光记，歌词好像是：哈一口气就变成仙女。然后做我后面的后面的drq听到了说：“哈一口气就变成仙女？”大概当时是内心狂喜的。又想起来之前和同桌唱夜宴风波，后面同桌说她听到drq说我唱歌好听。emm…现在想起来当时真的高兴坏了,5851678150,3,2023-02-08 19:57:21
笙兮澈,2138663589,20,2,350000,350200,桃李春风一杯酒，江湖夜雨十年灯。,青梅竹马真的很美好啊啊啊啊啊 可惜我没有 但是这种古风歌曲描写的孩提时代 也让我怀念我童年的一切✨,5851470337,2,2023-02-08 11:26:43
Sy_Orchid,375922238,0,2,210000,210100,,剑拥明月，竹竹簌簌,5851408839,2,2023-02-08 08:01:07
只是缺少浪漫,1435633128,0,0,0,100,一切顺利,真怀念小时候呀，长大了才知道人与人之间的差距和现实的丑陋,5851139153,3,2023-02-07 19:54:55
探花信,4046647210,0,0,0,100,只听其歌，不评其人，红时不追，落时不黑，只赏其作，不问是非。,迟意yyds,5850958670,2,2023-02-07 12:43:38
亲爱的旅人_s,3244907261,0,0,0,100,这个人太懒了，什么都没有留下。,一起加油,5850203397,1,2023-02-06 13:58:02
徘槐_,3294242359,15,2,110000,110101,烟花易逝 人情常存,这才叫古风歌啊，看看现在古风都是啥,5849941156,4,2023-02-05 23:46:59
徘槐_,3294242359,15,2,110000,110101,烟花易逝 人情常存,早就是家人了吧，希望你们能一直保持恋爱的甜蜜,5849935641,2,2023-02-05 23:44:33
22222Wu,3284215855,18,2,360000,360100,我们都会闪闪发光的,看小说看多了，你这最后一句有点像病娇诶，划掉划掉，别管这句🤐，哥们加油！！！,5849646736,5,2023-02-05 15:37:20
格兰芬多的思媛星辰,1973832279,14,2,1000000,1007700,学分｜哈迷｜不加糖｜咒术回战｜阴阳怪气,2018的时候被小豆蔻推荐来听的，现在听起来还是觉得好听[可爱],5849633478,3,2023-02-05 15:22:28
仅梦-,8009998752,0,1,370000,370800,人生难得是欢聚，惟有别离多。,唯美而富有文艺,5849419279,2,2023-02-05 07:36:24
烬雾z,2056130516,16,2,440000,441400,,好听,5849374899,0,2023-02-05 02:38:47
dlwlrma-L,324009395,23,1,330000,331100,每天保持好心情！,1,5849306190,0,2023-02-05 00:29:46
那漾白,365120559,0,0,440000,440300,,唐宋元明清那句很有感觉,5849064683,0,2023-02-04 19:22:10
狐狸好了就是变笨了,1928413326,0,2,320000,320800,,为什么 我感觉很有味道 怪不得会变前女友[多多大笑],5849051262,1,2023-02-04 18:54:56
Flyaware,8237989325,14,1,610000,610100,,我自小到大都没有一个能交心的朋友,5848785722,1,2023-02-04 11:19:01
阿阿阿阿阿淼-,7815870658,0,2,130000,130600,清风揽明月,大多都是遗憾终场，我之前认识隔壁的一个小男孩，俩人在一个学校，放学了就一起玩。但是自从搬家了之后我们的接触就少很多了，估计现在问他他也会回答不认识吧……毕竟大家都长大了无法再向之前小时候那样一起玩了,5848660529,4,2023-02-04 02:57:38
阿阿阿阿阿淼-,7815870658,0,2,130000,130600,清风揽明月,陆景和[多多可怜],5848655628,0,2023-02-04 02:55:24
A_my_03,2014077946,16,2,150000,150700,都好好的吧,青梅竹马如果没有竹马的话青梅也是可以的吧😋,5848214234,2,2023-02-03 16:47:33
林间梦游,7965428566,0,1,0,100,Wooooo！,有过，不过她从小读红楼，结果我就不提了,5847448779,0,2023-02-02 15:39:26
温馆长,1346503338,0,0,0,100,,岁月走走停停那一段真的听着有一段像薛之谦的认真的雪,5847406976,0,2023-02-02 14:47:37
是你009,620177251,0,0,0,100,近而疏者，志不合也。,纵前路荆棘遍野，亦将坦然无惧仗剑随行,5846500028,0,2023-02-01 08:16:28
第十理想人间,1433208184,0,0,0,100,,我看依然忘不了鲜衣怒马的少年郎,5845850063,2,2023-01-31 13:19:13
你怎么跟个番薯一样,610389714,23,0,330000,330100,,加油！千万不要有一刻放弃自己！,5845602883,0,2023-01-31 00:31:41
銰徳懞特哋豞,4028637893,0,2,350000,350900,,哈哈哈，同感,5845472887,2,2023-01-30 21:46:00
齐司礼的在逃未婚妻,353259147,0,0,0,100,勇敢的人先享受世界,好家伙，小说情节了属于是，追个更，后续呢,5845273165,0,2023-01-30 16:29:13
断了情欲,107572467,5,1,320000,320300,我不过是皑皑繁星中的一尘,头顶月眼中你,5844958900,2,2023-01-30 02:35:03
可乐我能喝十瓶,73680662,25,1,440000,441900,每天,其实我 真的不想错过你，但是我好像，真的接近不了你,5844519827,3,2023-01-29 17:35:32
盖被烤火小狸奴,510822274,0,2,0,100,近朱者赤，近我者甜,巨无敌好听,5844356465,0,2023-01-29 13:06:36
你你oni,1298006464,24,2,410000,410100,“你那么挑剔还是选错了”,转正，发财，上岸,5844282207,0,2023-01-29 10:42:40
那年-忆梦誓华,1951063025,0,1,440000,440100,,加油,5844217449,1,2023-01-29 08:21:12
blue的moon,1826667451,0,2,0,100,That's more my tempo。,“头顶月 眼中你 🌙”,5844214512,4,2023-01-29 07:58:31
麻薯麻薯要谦虚,85627394,23,2,530000,530100,温柔以待每一个人,没有青梅竹马，但是有俩发小[多多亲吻],5844186924,1,2023-01-29 03:21:28
我来了哦hh,376271314,0,2,650000,652200,,没毛病，说的真对,5843943333,1,2023-01-28 20:57:38
行舟吖_,1553859182,17,2,610000,610100,....,2023了还是觉得好听 每一首歌都会找到和你共鸣的人 词写出的是你内心感觉 顺心就好呢,5843794681,0,2023-01-28 16:46:19
行舟吖_,1553859182,17,2,610000,610100,....,拍拍头~,5843799832,0,2023-01-28 16:45:04
考上中国政法了,1442479442,18,2,110000,110101,考上中国政法了,初中听的这首歌，高中成了文科生,5843338377,1,2023-01-27 22:09:25
二致ox,1922508818,18,1,340000,340400,从来佳期不易得.,果然心动模式让我听到很多好歌嘿嘿嘿,5843155195,0,2023-01-27 17:03:32
无辰先生,444044665,0,0,370000,370100,,如闻仙乐,5843146287,0,2023-01-27 16:49:25
帐号已注销,502237531,无,无,无,无,无,单曲循环+1,5842542647,0,2023-01-26 18:23:06
12xti,503394408,23,2,210000,211000,,主动招惹和随便聊几句是不一样的 这位兄台没经历过是吧？,5842229187,1,2023-01-26 04:26:58
古早小魚,354202417,0,0,0,100,,一定要幸福！！！,5841803317,1,2023-01-25 14:57:04
Kove-00,565682981,0,2,810000,810100,,我也没…,5840931459,2,2023-01-23 23:57:33
Kove-00,565682981,0,2,810000,810100,,一定要幸福啊啊啊啊啊啊啊,5840929576,0,2023-01-23 23:57:24
晓色云天,285641580,0,0,0,100,,我有满心欢喜，头顶月眼中你。,5840874525,1,2023-01-23 22:32:33
慕里1708,558348530,0,1,110000,110101,,QQ,5840824893,0,2023-01-23 21:08:41
Catlina7,2113130183,0,2,0,100,“我们曾在高朋满座中将隐晦爱意说到最尽兴可我只看向他眼底而千万人欢呼什么 我不关心”,玛雅我也看那个了,5840812141,0,2023-01-23 20:50:13
瑶yao_TsoX,4897722706,0,0,360000,360100,,春晚……,5840705602,1,2023-01-23 17:14:55
气质小范,1877879172,0,2,310000,310101,无,xwh,5840586117,0,2023-01-23 12:37:37
希望和喜欢撞个满怀,1591456843,20,2,450000,450100,我不想有坏情绪 我想早睡,家人是健康的 长相是漂亮的 成绩是优秀的 朋友是合心的 男人是真心的，越来越漂亮、家庭是越来越幸福越有钱的的，身体也是越来越健康的，学业是越来越好，考试上岸 家人身体健康 财源广进,5840277916,27,2023-01-22 21:32:52
亻故梦,1720261444,23,0,330000,330900,因为个性所以没有签名！,人生如梦,5839998075,1,2023-01-22 10:58:37
灵陌n,4012515806,0,2,0,100,,从小学就开始听这首歌了，已经高中了，还是没听腻[多多大笑],5839576066,2,2023-01-21 17:44:50
长宁_G,1485320082,15,2,420000,420300,长安宁，多喜乐,带着我的祝福滚蛋😡,5839449535,0,2023-01-21 13:12:24
蜩螗戏言,560898818,0,1,0,100,「怀呆琴静」，已是过往。；「拥云望月不见君」，已逝。沉稳，克己些吧。倾听、反感、分析、学习、摒除杂念。加油。任之漂浮吧。反正世间皆然。还是要平复平静下来呵。寻静。自然是无冢的。又是空洞（hollow）了。可惜成不了骑士，自然见不到王。然而也还有着方向。心之所向。然而也总有世事蜩螗的无奈。“他强任他强，清风拂山岗”“他横任他横，明月照大江”不必，亦不必。无与有，虚共实。拨云见日便是了。能够望着，便也足了。又何必扰了岁月的涟漪，而无法共候春夏的轮替。于山水之间，于林中，有曲委婉。便好了。纵有天顶之念，亦要委身于穴。,加油哦,5838673815,0,2023-01-20 09:58:19
沧海无题雪,1528764719,1,1,520000,522400,林中抚琴曲委婉，群山听懂我悲欢。,轻快代表作之一，我是真的喜欢,5838632585,5,2023-01-20 08:04:51
Joan小不登,362475565,0,1,430000,433100,忽然一瞬间长大，就像被时间的手擦模糊的画，我们啊各自要去哪，问题好傻谁又能回答……,好爱银临的古风歌,5838276352,2,2023-01-19 18:51:11
十有八九9j,527885105,22,1,440000,440300,,听过最甜的一首古风,5838076393,13,2023-01-19 13:40:46
我欲成风归,3876784837,0,2,0,100,再饮吞日月,我也觉得6,5838052975,1,2023-01-19 12:47:09
长椅上的猫SHU,6437616410,0,2,510000,511400,。。。。。,没有竹马的我默默羡慕你们，但歌真的好好听~,5837966233,1,2023-01-19 10:09:36
atrisaikou,1520061698,0,0,0,100,祝你开心。,加油,5837883356,0,2023-01-19 03:31:07
atrisaikou,1520061698,0,0,0,100,祝你开心。,祝福,5837884156,0,2023-01-19 03:29:55
猫二咪maoermi,647170608,0,1,220000,220100,,我的青梅竹马啊，是假的，是我臆想出来的，没有拥有过就谈不上失去,5837446964,1,2023-01-18 15:37:45
建州左卫指挥使李如彘,307404530,1,1,430000,430700,,网抑云，看见每一种刚编的故事,5837302148,1,2023-01-18 11:44:12
kiwifruit耶,1740303988,0,2,0,100,生命久如暗室，我在春招颂歌,头顶月 眼中你,5837283579,0,2023-01-18 11:21:54
墨青铜葵,3266446224,19,1,340000,340400,,羡慕啊,5837092680,0,2023-01-18 00:56:48
